,answer_text,content,diner_date,id_comment,id_resto,other_ratings_category,other_ratings_value,rating,rating_date,resto,resto_url,reviewer_info_sup,reviewer_origin,reviewer_pseudo,title,url
200,,"['My wife and I have now visited the Ivy in the Park on two separate occasions and have found it to be as good as the original location.', 'Service was excellent and the staff are fully knowledgable about what is, to all intents and purposes, a standard menu across the chain. The shepherds pie was indeed excellent and just as we have experienced at West Street (the original).', ""A lot of effort has gone into making the interior seem as though it is straight from the 1930's and once inside you would not think the place is brand new. Tables are close together, but no more than you would find at West Street."", 'The Ivy in the Park is a welcome addition tor restaurants in Canary Wharf and is well worth a visit at the weekends. We booked ahead on the day and found a table so always worth a try - we have put this now on our regular list.']", January 2019,g186338-d15238588-r646365024,g186338-d15238588,"['Value', 'Service', 'Food']","['40', '50', '50']",5,16 January 2019,The_Ivy_Canary_Wharf,/Restaurant_Review-g186338-d15238588-Reviews-The_Ivy_Canary_Wharf-London_England.html,"[['pencil-paper', '66'], ['thumbs-up-fill', '32']]",['London England'],Buns4vs,As Good As The Original,https://www.tripadvisor.co.uk/ShowUserReviews-g186338-d15238588-r646365024-The_Ivy_Canary_Wharf-London_England.html
201,,"[""My fiancee and I went here for our evening meal prior to going out for the evening on a Friday night. We arrived early and we were seated at our table which over looked the ice rink which was delightful! We were pressured to order drinks every few minutes and we weren't given time to look at the menus it was as if they wanted to rush us out yet it was half empty, it was only 5pm! We ordered some drinks and some sourdough bread to share as a starter which was great I must add... However as soon as the waiter picked up the empty bread basket within 10 seconds our mains were on the table and that was no exaggeration!!! How can we be expected to eat a main within seconds of eating our starters. There was zero breathing space between the two courses it was rush rush rush. We both didn't finish our meals as a result of this. I complained to a member of staff whom got his manager. The manager was very apologetic and so rightly so! She did remove our mains from the bill which was good of her but still it doesn't make up for the nice evening that was ruined by forcing us out the door. Ivy Park you lost out on good customers here. We shall not be returning! ""]", December 2018,g186338-d15238588-r639719035,g186338-d15238588,[],[],1,15 December 2018,The_Ivy_Canary_Wharf,/Restaurant_Review-g186338-d15238588-Reviews-The_Ivy_Canary_Wharf-London_England.html,"[['pencil-paper', '10'], ['thumbs-up-fill', '11']]",[],Martin S,Ivy Pants not Ivy Park!!! ,https://www.tripadvisor.co.uk/ShowUserReviews-g186338-d15238588-r639719035-The_Ivy_Canary_Wharf-London_England.html
202,,['Lovely decor and great food! Really good that they offer all day dining and you can also have a quick meeting over coffee. Great service too!'], November 2018,g186338-d15238588-r639589682,g186338-d15238588,"['Value', 'Service', 'Food']","['40', '50', '50']",5,14 December 2018,The_Ivy_Canary_Wharf,/Restaurant_Review-g186338-d15238588-Reviews-The_Ivy_Canary_Wharf-London_England.html,"[['pencil-paper', '246'], ['thumbs-up-fill', '76']]","['London, United Kingdom']",SMOOZA,Excellent!,https://www.tripadvisor.co.uk/ShowUserReviews-g186338-d15238588-r639589682-The_Ivy_Canary_Wharf-London_England.html
203,,"['I went in a group of 6 people. Every appetizer, main course, and dessert was outstanding. Everyone was blown away by the delicious food. Nice views and atmosphere too. Huge, diverse menu. Not cheap but for what you get prices are a good value.']", January 2019,g186338-d15238588-r647851586,g186338-d15238588,"['Value', 'Service', 'Food']","['40', '40', '50']",5,23 January 2019,The_Ivy_Canary_Wharf,/Restaurant_Review-g186338-d15238588-Reviews-The_Ivy_Canary_Wharf-London_England.html,"[['pencil-paper', '25'], ['thumbs-up-fill', '11']]",['New York'],Jonathan H,One of the best meals I've ever had,https://www.tripadvisor.co.uk/ShowUserReviews-g186338-d15238588-r647851586-The_Ivy_Canary_Wharf-London_England.html
204,,"[""Went to have brunch here with a couple friend and my 18-year old daughter this December and was very happy with the experience. From the Ivy Royale (a sparkling cocktail that was just impossible to resist) to the Chicken Milanese and the Chocolate Bombe- everything was really good! I also liked the fact that despite it being full, we couldn't hear other people's conversations. Loved the vibe. I have been to many places where you pay for the ambience and nothing else. The Ivy in the Park is not one of those. Will definitely be back on my next trip.""]", December 2018,g186338-d15238588-r642127818,g186338-d15238588,"['Value', 'Service', 'Food']","['40', '40', '40']",4,29 December 2018,The_Ivy_Canary_Wharf,/Restaurant_Review-g186338-d15238588-Reviews-The_Ivy_Canary_Wharf-London_England.html,"[['pencil-paper', '92'], ['thumbs-up-fill', '91']]","['Bangkok, Thailand']",travellingmama1,Lovely weekend brunch,https://www.tripadvisor.co.uk/ShowUserReviews-g186338-d15238588-r642127818-The_Ivy_Canary_Wharf-London_England.html
205,,"['We ate at The Ivy in the Park the Friday evening before Christmas. The restaurant was beautifully decorated for the festive season. We were welcomed on arrival and given a table in the bar area for pre dinner cocktails. Our dinner table was upstairs where the subtle lighting, huge glass windows and foliage create a magical ambiance. We all enjoyed our meals. I’d personally recommend the Black Cod. Service was very good and we had a relaxed but excellent meal. ', 'The restaurant has a great location. A short walk from Canary Wharf station. Definitely one to return to. ']", December 2018,g186338-d15238588-r642549804,g186338-d15238588,[],[],5,31 December 2018,The_Ivy_Canary_Wharf,/Restaurant_Review-g186338-d15238588-Reviews-The_Ivy_Canary_Wharf-London_England.html,"[['pencil-paper', '24'], ['thumbs-up-fill', '4']]",[],G9398CHsusanh,Perfect evening.,https://www.tripadvisor.co.uk/ShowUserReviews-g186338-d15238588-r642549804-The_Ivy_Canary_Wharf-London_England.html
206,,"['Weekend brunch was lovely. We was seated straight away. The service was ok. ', 'The staff was nice. Maybe because they was busy but the staff kept forgetting little things. ', 'We wanted ketchup and mayo: we had to ask another waitress for it. We ordered two chocolate bombs and only was given one.', 'Again had to ask the waitress if it’s just the one they given us and she said yes. Had to explain we ordered two! But told them don’t worry we just keep the one! So slightly disappointed in their service! ', 'The food was nice but service could’ve been better. Atmosphere and venue was lovely and prices are affordable ']", January 2019,g186338-d15238588-r644919775,g186338-d15238588,[],[],4,10 January 2019,The_Ivy_Canary_Wharf,/Restaurant_Review-g186338-d15238588-Reviews-The_Ivy_Canary_Wharf-London_England.html,"[['pencil-paper', '106'], ['thumbs-up-fill', '31']]","['Essex, United Kingdom']",BonBonsBeauty,Lovely brunch ,https://www.tripadvisor.co.uk/ShowUserReviews-g186338-d15238588-r644919775-The_Ivy_Canary_Wharf-London_England.html
207,,"['I went with friends for coffee ! Was really nice ! I like their crème brûlée so delicious even chocolate bombe was amazing ', 'I definitely recommend it ', 'Well done ']", December 2018,g186338-d15238588-r641854047,g186338-d15238588,[],[],4,27 December 2018,The_Ivy_Canary_Wharf,/Restaurant_Review-g186338-d15238588-Reviews-The_Ivy_Canary_Wharf-London_England.html,"[['pencil-paper', '34'], ['thumbs-up-fill', '1']]","['London, United Kingdom']",sanou65,Really nice !,https://www.tripadvisor.co.uk/ShowUserReviews-g186338-d15238588-r641854047-The_Ivy_Canary_Wharf-London_England.html
208,,['Met up with a group of friends from high school some of them I’ve not seen for more than 30 years. We had a great time. Food was fantastic and the atmosphere was superb. Will definitely be going back.'], January 2019,g186338-d15238588-r646094732,g186338-d15238588,[],[],5,15 January 2019,The_Ivy_Canary_Wharf,/Restaurant_Review-g186338-d15238588-Reviews-The_Ivy_Canary_Wharf-London_England.html,"[['pencil-paper', '10'], ['thumbs-up-fill', '8']]",[],Escape759631,Fabulous!!!!,https://www.tripadvisor.co.uk/ShowUserReviews-g186338-d15238588-r646094732-The_Ivy_Canary_Wharf-London_England.html
209,,"[""We booked for the Ivy for an early dinner on new year's eve. We wanted to eat at around 8pm but only 7pm was available online. We visited the restaurant earlier in the day to check if there was a later time but there wasn't. As we were getting ready I got a call to say that we could arrive later as there had been cancellations. We were really impressed that they had made the effort to contact us. On arrival we were warmly welcomed and seated upstairs. My seat was on a comfy banquette but my husband told me later that he kept being bumped by people walking past so felt like he was in a corridor. From the menu we selected the truffled orzo pasta and the scallops for starters, which were both good, then tuna loin and shepherds pie for mains with sides of spinach and truffle chips. It turned out that the sides probably weren't needed but we succumbed to the upselling from the waitress. Both main dishes were very good, well cooked and flavoursome. For dessert we shared the passion fruit baked Alaska, which was a nice balance of sweet and tangy. To drink we shared an entry-price bottle of Bordeaux which we enjoyed. Water was topped up regularly. It was a nice atmosphere and service was good apart from the upselling. Overall a very nice meal.""]", December 2018,g186338-d15238588-r645393851,g186338-d15238588,"['Value', 'Service', 'Food']","['30', '40', '40']",4,12 January 2019,The_Ivy_Canary_Wharf,/Restaurant_Review-g186338-d15238588-Reviews-The_Ivy_Canary_Wharf-London_England.html,"[['pencil-paper', '480'], ['thumbs-up-fill', '226']]",['London'],SCSLondon,Good experience,https://www.tripadvisor.co.uk/ShowUserReviews-g186338-d15238588-r645393851-The_Ivy_Canary_Wharf-London_England.html
210,,['Was proposed the Ivy as it’s new and well I was not disappointed. The place it’s a very comfortable garden room with the elegance of fine dinning with a more relaxed feel. The staff were great and the food was fantastic.'], November 2018,g186338-d15238588-r637698611,g186338-d15238588,[],[],5,5 December 2018,The_Ivy_Canary_Wharf,/Restaurant_Review-g186338-d15238588-Reviews-The_Ivy_Canary_Wharf-London_England.html,"[['pencil-paper', '40'], ['thumbs-up-fill', '6']]","['London, United Kingdom']",jamesbE6333BO,Breakfast ,https://www.tripadvisor.co.uk/ShowUserReviews-g186338-d15238588-r637698611-The_Ivy_Canary_Wharf-London_England.html
211,,"['We had Sunday lunch at the Ivy. We were quite excited in having a new restaurant in the area. The decor at Ivy is lovely. It’s colourful and has lots of plants giving a feeling of freshness in the restaurant. We were seated in the top floor and had good views.', 'We started with courgette fritters which was lovely and plenty. For starters my wife ordered yellowfin tuna while I ordered crispy duck salad. We loved both of are starters. For mains we both ordered the miso black cod- we love this dish and we’re not disappointed. ', 'The service was great and we were well looked after. We will definitely be coming back.']", December 2018,g186338-d15238588-r637036570,g186338-d15238588,[],[],5,2 December 2018,The_Ivy_Canary_Wharf,/Restaurant_Review-g186338-d15238588-Reviews-The_Ivy_Canary_Wharf-London_England.html,"[['pencil-paper', '104'], ['thumbs-up-fill', '46']]","['London, United Kingdom']",paptan1,Nice decor and lovely food,https://www.tripadvisor.co.uk/ShowUserReviews-g186338-d15238588-r637036570-The_Ivy_Canary_Wharf-London_England.html
212,,"['I love the Ivy chain and this one is lovely and quirky and exceptionally clean. We popped in for a quick lunchtime drink and the care and attention taken in making and serving them was a delight.', 'Lots of outdoor space with lovely blankets.', 'We will definitely return to this one as it really was comfortable and the decor inspiring. ']", December 2018,g186338-d15238588-r637156255,g186338-d15238588,[],[],5,3 December 2018,The_Ivy_Canary_Wharf,/Restaurant_Review-g186338-d15238588-Reviews-The_Ivy_Canary_Wharf-London_England.html,"[['pencil-paper', '161'], ['thumbs-up-fill', '64']]","['Brighton, United Kingdom']",722sarahb,Reliable ,https://www.tripadvisor.co.uk/ShowUserReviews-g186338-d15238588-r637156255-The_Ivy_Canary_Wharf-London_England.html
213,,"['My and 3 of my friends went for dinner. We were excited as it all looked very nice. The decor was beautiful. 2 of us ordered seabass dish, the waiter took our orders all OK. After about 30 minutes of waiting, the waiter came back to say they have run out of seabass. So, then we placed another option. The order came, I ordered the salmon which was nice. Overall, beautiful decor, service poor. Also, be aware the floor is very slippery!']", December 2018,g186338-d15238588-r636924125,g186338-d15238588,[],[],3,1 December 2018,The_Ivy_Canary_Wharf,/Restaurant_Review-g186338-d15238588-Reviews-The_Ivy_Canary_Wharf-London_England.html,"[['pencil-paper', '1']]",[],Connector47334297063,Waiters/waitresses need to be quicker and more on the ball!,https://www.tripadvisor.co.uk/ShowUserReviews-g186338-d15238588-r636924125-The_Ivy_Canary_Wharf-London_England.html
214,,"['I have visited pretty much all of the Ivy’s in London, and they’re one of my favourite restaurants. We thought we’d try the new one in Canary Wharf and were excited to do so.', 'I have to say, we weren’t disappointed! It’s probably my favourite one. It’s done up so pretty and overlooks the ice rink.', 'The bar there was great and the barmen kept us entertained. Walter was a great host and made sure we always had a cocktail (although there was no candy floss for the candy floss cocktail).', 'The steak was a bit on the colder side and the chips had to be sent back as they were inedible, the spinach could have done with going back too but we kept it. ', 'Because the service had been so good it didn’t ruin our night, and we had a great night - we will definitely return ']", December 2018,g186338-d15238588-r638586993,g186338-d15238588,[],[],4,10 December 2018,The_Ivy_Canary_Wharf,/Restaurant_Review-g186338-d15238588-Reviews-The_Ivy_Canary_Wharf-London_England.html,"[['pencil-paper', '68'], ['thumbs-up-fill', '61']]","['London, United Kingdom']",_SBHx,Christmas dinner & cocktails ,https://www.tripadvisor.co.uk/ShowUserReviews-g186338-d15238588-r638586993-The_Ivy_Canary_Wharf-London_England.html
215,,"['Love this place. The menu is extensive, the food really good the service is great and the decor is lovely. Reasonably priced too. Will definitely return very soon.']", December 2018,g186338-d15238588-r639414303,g186338-d15238588,[],[],5,13 December 2018,The_Ivy_Canary_Wharf,/Restaurant_Review-g186338-d15238588-Reviews-The_Ivy_Canary_Wharf-London_England.html,"[['pencil-paper', '44'], ['thumbs-up-fill', '21']]","['London, United Kingdom']",409rajc,Great addition to Canary wharf,https://www.tripadvisor.co.uk/ShowUserReviews-g186338-d15238588-r639414303-The_Ivy_Canary_Wharf-London_England.html
216,,"['The good lady and I visited for dinner on a Saturday night. We were seated on the first floor overlooking the Ice Rink Canary Wharf. The staff are great, very helpful and knowledgeable about the menu.', 'There was music playing down stairs but not overly loud and we had no issues with it.', 'It’s quite sophisticated but laid back a great place to dine.', 'The bill was not spiteful, in fact very reasonable.', 'Can’t wait to return.']", December 2018,g186338-d15238588-r638638667,g186338-d15238588,[],[],5,10 December 2018,The_Ivy_Canary_Wharf,/Restaurant_Review-g186338-d15238588-Reviews-The_Ivy_Canary_Wharf-London_England.html,"[['pencil-paper', '135'], ['thumbs-up-fill', '120']]","['Bapchild, United Kingdom']",TKLontour,Loved the Ivy.....,https://www.tripadvisor.co.uk/ShowUserReviews-g186338-d15238588-r638638667-The_Ivy_Canary_Wharf-London_England.html
217,,"['I visited the Ivy in the park this evening for dinner with my mum as part of an early Xmas gift.', 'The decor is beautiful, we were sat upstairs overlooking the ice rink. The service was outstanding.', 'We both had a classic champagne cocktail.', 'For starters the duck and watermelon dish- beautiful.', 'Mains the shepherds pie and the shoulder of lamb with green beans and wilted spinach.', 'I could have eaten more of the Sheppard’s pie ifs the portion was bigger. ', 'For desert we had the creme brûlée and the rum baba.', 'The atmosphere and food were equally great. I would advise you to book ahead as it is very popular.', '5/5! ']", December 2018,g186338-d15238588-r638967929,g186338-d15238588,[],[],5,11 December 2018,The_Ivy_Canary_Wharf,/Restaurant_Review-g186338-d15238588-Reviews-The_Ivy_Canary_Wharf-London_England.html,"[['pencil-paper', '20'], ['thumbs-up-fill', '21']]","['London, United Kingdom']",722evieh,Highly recommend ,https://www.tripadvisor.co.uk/ShowUserReviews-g186338-d15238588-r638967929-The_Ivy_Canary_Wharf-London_England.html
218,,"[""As with every Ivy off shoot, this branch carries the same menu and similar decor to the original in West Street so you always know what you're going to get. You can eat expensive, or inexpensive depending on your pocket on the day, but one thing's for certain...you'll always have a phenomenal meal."", 'The staff here are awesome, and the atmosphere great too. ', 'We ate late for lunch and early for dinner, then walked to the station and rode for one stop to the O2. What a perfect way to start the evening, with perfect food and perfect wine....thank you Ivy']", December 2018,g186338-d15238588-r639180574,g186338-d15238588,"['Value', 'Service', 'Food']","['50', '50', '50']",5,12 December 2018,The_Ivy_Canary_Wharf,/Restaurant_Review-g186338-d15238588-Reviews-The_Ivy_Canary_Wharf-London_England.html,"[['pencil-paper', '114'], ['thumbs-up-fill', '74']]","['Leigh-on Sea, United Kingdom']",jandrewsesq,"Home from home, very close to O2 and City",https://www.tripadvisor.co.uk/ShowUserReviews-g186338-d15238588-r639180574-The_Ivy_Canary_Wharf-London_England.html
219,,"[""My first visit to the Ivy in Canary Wharf which has been open for around a month now. In may other locations the Ivy would just be another restaurant generally in the top quartile, but in Canary Wharf it is easily in the top three. Many of the restaurants in Canary Wharf are a disappointment being soul less, average quality at best, and poor value, but the Ivy does raise the standard with a good location, generally good service, but could be better which hopefully will come as they get established. Could not complain about the food and wine all in line with other Ivy's, so will certainly be returning on a regular basis.""]", November 2018,g186338-d15238588-r633907020,g186338-d15238588,"['Value', 'Service', 'Food']","['40', '40', '50']",4,17 November 2018,The_Ivy_Canary_Wharf,/Restaurant_Review-g186338-d15238588-Reviews-The_Ivy_Canary_Wharf-London_England.html,"[['pencil-paper', '133'], ['thumbs-up-fill', '78']]","['Royal Tunbridge Wells, United Kingdom']",ajp9000,A great addition to Canary Wharf.........,https://www.tripadvisor.co.uk/ShowUserReviews-g186338-d15238588-r633907020-The_Ivy_Canary_Wharf-London_England.html
220,,"['Upon my arrival into the restaurant the service received was warm, welcoming, accommodating and very professional. ', 'A wide option of choice for drinks: Jamaican Wray & Nephew white rum was there. The food was delicious ', 'Overall: a humbling experience ', 'I would like to use this opportunity to say Thank you to the staff for providing an wonderful experience ']", November 2018,g186338-d15238588-r638979044,g186338-d15238588,[],[],4,11 December 2018,The_Ivy_Canary_Wharf,/Restaurant_Review-g186338-d15238588-Reviews-The_Ivy_Canary_Wharf-London_England.html,"[['pencil-paper', '22'], ['thumbs-up-fill', '17']]","['London, United Kingdom']",SimoneLucia,Superb,https://www.tripadvisor.co.uk/ShowUserReviews-g186338-d15238588-r638979044-The_Ivy_Canary_Wharf-London_England.html
221,,"['This was our second time at the Ivy. We just had dinner there and the food was as good as their afternoon tea. ', 'We had prawn tempura as starters which had a different take from the traditional Japanese tempura. ', 'The main course, Lobster linguine was light and tasty and lastly the apple tart was superb especially if you like it with an after taste of alcohol as they set it on fire at the table, like you do on a Christmas cake. ', 'As it was a birthday booking, I was given a little birthday pastry with a little candle and a piece of chocolate that said Happy Birthday. ', 'We we well looked after by the waitress and Valerio whom we remembered from our first visit. Looking forward to our next meal there with the children.']", November 2018,g186338-d15238588-r636745940,g186338-d15238588,[],[],5,30 November 2018,The_Ivy_Canary_Wharf,/Restaurant_Review-g186338-d15238588-Reviews-The_Ivy_Canary_Wharf-London_England.html,"[['pencil-paper', '7'], ['thumbs-up-fill', '2']]","['London, United Kingdom']",WML7613,Fab place for quality and GOOD pastry,https://www.tripadvisor.co.uk/ShowUserReviews-g186338-d15238588-r636745940-The_Ivy_Canary_Wharf-London_England.html
222,,"[""Couldn't fault anything about our meal at The Ivy in the Park, lovely location, great atmosphere, Amazing food, would recoment the shepards pie the prawn and monkfish curry, crispy duck salad and truffle baked orzo pasta. Will definitely be returning and recommending to friends and family.""]", November 2018,g186338-d15238588-r634471275,g186338-d15238588,"['Value', 'Service', 'Food']","['50', '50', '50']",5,19 November 2018,The_Ivy_Canary_Wharf,/Restaurant_Review-g186338-d15238588-Reviews-The_Ivy_Canary_Wharf-London_England.html,"[['pencil-paper', '18'], ['thumbs-up-fill', '3']]",[],Alexljones,Fantasic food and lovely atmosphere,https://www.tripadvisor.co.uk/ShowUserReviews-g186338-d15238588-r634471275-The_Ivy_Canary_Wharf-London_England.html
223,,"['We turned up without reservation and they went out of their way to make sure we got a table and did not go elsewhere. Very nice service, felt valued as a customer. Food and drinks were up to the Ivy standard, we had a great meal here.']", October 2018,g186338-d15238588-r634076230,g186338-d15238588,"['Value', 'Service', 'Food']","['50', '50', '50']",5,18 November 2018,The_Ivy_Canary_Wharf,/Restaurant_Review-g186338-d15238588-Reviews-The_Ivy_Canary_Wharf-London_England.html,"[['pencil-paper', '150'], ['thumbs-up-fill', '100']]",['London'],erika2205,Exceptional service,https://www.tripadvisor.co.uk/ShowUserReviews-g186338-d15238588-r634076230-The_Ivy_Canary_Wharf-London_England.html
224,,"[""Was very excited to see the Ivy being built in Canary Wharf and eventually we managed a lunch booking last week. Was surprised how busy it was even though we got there early. However service was good and our food and drinks came quickly. Our server was very pleasant and didn't pressure us when we took our time ordering"", ""We did have one issue when our 2nd round of drinks didn't turn up. But a manager came by to apologise and offered complimentary chocolate truffles. "", 'Cocktails are good. Food has plenty of options and not that pricey! ', 'Will definitely be back ']", November 2018,g186338-d15238588-r635681207,g186338-d15238588,[],[],4,25 November 2018,The_Ivy_Canary_Wharf,/Restaurant_Review-g186338-d15238588-Reviews-The_Ivy_Canary_Wharf-London_England.html,"[['pencil-paper', '290'], ['thumbs-up-fill', '111']]","['London, United Kingdom']",mrsGiroud,Another Ivy restaurant,https://www.tripadvisor.co.uk/ShowUserReviews-g186338-d15238588-r635681207-The_Ivy_Canary_Wharf-London_England.html
225,,"['Was taken there after a meeting recently and having heard of, but never eaten in any of the Ivy chain, I was looking forward to the occasion. ', 'The restaurant is bright, in places, with a nice buzz. The service was good, attentive without being intrusive. Wines can be pricey if you have the budget.', 'The food was good. I had smoked salmon with crab, followed by sea bass. Some of the others had steak which was well received. The side dishes, which are essential, were ok.', 'The Cliff Richard comment? We were allocated to a table in the part which has “ivy” on the ceiling and it was so dark that we had to use our phones as torches to be able to read the menu. There were a few lamps, not on all tables, but the lighting is just not acceptable in that part. So specify that you want to be seated elsewhere unless it is daylight!']", November 2018,g186338-d15238588-r635459708,g186338-d15238588,"['Value', 'Service', 'Food']","['30', '50', '40']",4,24 November 2018,The_Ivy_Canary_Wharf,/Restaurant_Review-g186338-d15238588-Reviews-The_Ivy_Canary_Wharf-London_England.html,"[['pencil-paper', '109'], ['thumbs-up-fill', '47']]","['Richmond, United Kingdom']",Indimenticabile,It was like a Cliff Richard concert with good food.,https://www.tripadvisor.co.uk/ShowUserReviews-g186338-d15238588-r635459708-The_Ivy_Canary_Wharf-London_England.html
