,answer_text,content,diner_date,id_comment,id_resto,other_ratings_category,other_ratings_value,rating,rating_date,resto,resto_url,reviewer_info_sup,reviewer_origin,reviewer_pseudo,title,url
133,,"['Attentive staff, lovely food and lovely atmosphere in restaurant. I enjoyed my crispy duck salad to start and I had fish and chips with mushy peas for main which was so yummy. Def recommend. ']", April 2019,g186338-d15238588-r666299098,g186338-d15238588,[],[],5,14 April 2019,The_Ivy_Canary_Wharf,/Restaurant_Review-g186338-d15238588-Reviews-The_Ivy_Canary_Wharf-London_England.html,"[['pencil-paper', '46'], ['thumbs-up-fill', '38']]","['London, United Kingdom']",Sazzle198428,Just lovely,https://www.tripadvisor.co.uk/ShowUserReviews-g186338-d15238588-r666299098-The_Ivy_Canary_Wharf-London_England.html
134,,"['We went to the Ivy for brunch during Easter weekend. The place is very pleasant and the food is very good. Service is excellent, our waitress Brigitta was very nice. ', 'Seating outside was only available by booking in advance, so we would advice to plan your visit in advance. Definitely one of the best places for a brunch in Canary Wharf!']", April 2019,g186338-d15238588-r668282582,g186338-d15238588,[],[],5,22 April 2019,The_Ivy_Canary_Wharf,/Restaurant_Review-g186338-d15238588-Reviews-The_Ivy_Canary_Wharf-London_England.html,"[['pencil-paper', '1']]",[],johnBLondon,Great Place for Brunch,https://www.tripadvisor.co.uk/ShowUserReviews-g186338-d15238588-r668282582-The_Ivy_Canary_Wharf-London_England.html
135,,"['Just had a most enjoyable lunch at The Ivy, Canary Wharf. Food was excellent with a rum baba to die for preceded by one of their house cocktails. It was too cold to sit outside on one of the terraces, however it was sunny and the outlook from the upstairs dining area gave a real spring feeling to the family occasion.']", April 2019,g186338-d15238588-r666556650,g186338-d15238588,"['Value', 'Service', 'Food']","['50', '50', '50']",5,15 April 2019,The_Ivy_Canary_Wharf,/Restaurant_Review-g186338-d15238588-Reviews-The_Ivy_Canary_Wharf-London_England.html,"[['pencil-paper', '2']]","['London, United Kingdom']",Chooch16,Sunday Lunch,https://www.tripadvisor.co.uk/ShowUserReviews-g186338-d15238588-r666556650-The_Ivy_Canary_Wharf-London_England.html
136,,"['I regularly take clients out for lunch and have a few places I tend to use but considering there is so much choice this list is small. Boisdales and Roka have been good for years. But now I have just experienced The Ivy in the park.', 'It was a Wednesday at 12.30 and was rammed so must be good', 'A very small table for 2 but enough room and was not too loud so could easily talk', 'Wine selection was very good and can recommend the Gavi.', 'Started with the Duck salad which I wolfed down as so damn tasty', 'Rather than my standard steak I opted for the Monkfish and prawn curry. well presented and I will have this again as was very good and light so a perfect lunch', 'No doubt I will now be a regular so looking forward to getting to know the team', 'Not cheap at £131 for 2 but was well worth it (wine was £50)', 'Enjoy']", April 2019,g186338-d15238588-r669084073,g186338-d15238588,"['Value', 'Service', 'Food']","['40', '50', '50']",5,25 April 2019,The_Ivy_Canary_Wharf,/Restaurant_Review-g186338-d15238588-Reviews-The_Ivy_Canary_Wharf-London_England.html,"[['pencil-paper', '211'], ['thumbs-up-fill', '49']]","['Welwyn Garden City, United Kingdom']",marcusp438,My new venue of choice in Canary Wharf,https://www.tripadvisor.co.uk/ShowUserReviews-g186338-d15238588-r669084073-The_Ivy_Canary_Wharf-London_England.html
137,,"['Had a lovely time at The Ivy in The Park. There was a lovely atmosphere, however, the music could be a little loud for some people. ', 'We ordered the Sea bass, fish & chips and shared a creme brulee for dessert. Absolutely delicious! Fabulous ingredients!', '£55.07 inclusive of service', 'Will be visiting again :-)']", April 2019,g186338-d15238588-r670006625,g186338-d15238588,[],[],4,28 April 2019,The_Ivy_Canary_Wharf,/Restaurant_Review-g186338-d15238588-Reviews-The_Ivy_Canary_Wharf-London_England.html,"[['pencil-paper', '15'], ['thumbs-up-fill', '7']]","['England, United Kingdom']",citizenoftheworld15,Great atmosphere and delicious food!,https://www.tripadvisor.co.uk/ShowUserReviews-g186338-d15238588-r670006625-The_Ivy_Canary_Wharf-London_England.html
138,,"[""A lovely late lunch in a very nice restaurant, we really enjoyed the meal which was tasty and well presented. Our waiter was super, very attentive and friendly. The location is quirky, right in the heart of Canary wharf, it's like a little bit of peace and quiet among the fast paced outside world!!!!""]", May 2019,g186338-d15238588-r671573026,g186338-d15238588,"['Value', 'Service', 'Food']","['40', '50', '40']",4,5 May 2019,The_Ivy_Canary_Wharf,/Restaurant_Review-g186338-d15238588-Reviews-The_Ivy_Canary_Wharf-London_England.html,"[['pencil-paper', '25'], ['thumbs-up-fill', '4']]","['London, United Kingdom']",Harninio,A very enjoyable experience!,https://www.tripadvisor.co.uk/ShowUserReviews-g186338-d15238588-r671573026-The_Ivy_Canary_Wharf-London_England.html
139,,['I visited the restaurant for anniversary dinner and was really disappointed. Went there because it was close to office and had a vegetarian menu. Food was below average and expensive. To make it worst they forgot the soup and starters we ordered and straight away gave main course. Only good thing was the ambience. I wouldn’t go there again.'], April 2019,g186338-d15238588-r671945734,g186338-d15238588,[],[],2,6 May 2019,The_Ivy_Canary_Wharf,/Restaurant_Review-g186338-d15238588-Reviews-The_Ivy_Canary_Wharf-London_England.html,"[['pencil-paper', '21'], ['thumbs-up-fill', '8']]","['London, United Kingdom']",v k,Disappointing,https://www.tripadvisor.co.uk/ShowUserReviews-g186338-d15238588-r671945734-The_Ivy_Canary_Wharf-London_England.html
140,,"['We visited to dinner.', 'The environment is nice and the staff very kind.', 'The menu has several options.', 'The food was served quickly and it was delicious!', 'We request steaks and monkfish curry and it were good options!', 'It is a good not exceptional.']", March 2019,g186338-d15238588-r661583051,g186338-d15238588,[],[],4,27 March 2019,The_Ivy_Canary_Wharf,/Restaurant_Review-g186338-d15238588-Reviews-The_Ivy_Canary_Wharf-London_England.html,"[['pencil-paper', '177'], ['thumbs-up-fill', '46']]","['Porto, Portugal']",joseaB565QB,Good option in Canary Wharf,https://www.tripadvisor.co.uk/ShowUserReviews-g186338-d15238588-r661583051-The_Ivy_Canary_Wharf-London_England.html
141,,"['Five of us had lunch on Saturday and were super impressed with the food and service ', 'Have been to the Ivy in Cambridge before so knew what to expect ', 'Super location, great comfortable restaurant with super friends ', 'Well worth a visit and would definitely return ']", March 2019,g186338-d15238588-r662666582,g186338-d15238588,[],[],5,1 April 2019,The_Ivy_Canary_Wharf,/Restaurant_Review-g186338-d15238588-Reviews-The_Ivy_Canary_Wharf-London_England.html,"[['pencil-paper', '47'], ['thumbs-up-fill', '25']]","['Saffron Walden, United Kingdom']",GOMReviews,Great ,https://www.tripadvisor.co.uk/ShowUserReviews-g186338-d15238588-r662666582-The_Ivy_Canary_Wharf-London_England.html
142,,"['Called in on spec for brunch on a sunny day. Warm welcome and seating on an enclosed terrace overlooking the green. The service was just ok. Professional but a little slower than we might have liked. Food and drink quality excellent although the ice cream was not as good as at the original. If weather is good, try and get a table on the first floor terrace but they are all ok. £100 for two drinks and three courses each was very fair value. We will be back!']", March 2019,g186338-d15238588-r662261185,g186338-d15238588,[],[],5,30 March 2019,The_Ivy_Canary_Wharf,/Restaurant_Review-g186338-d15238588-Reviews-The_Ivy_Canary_Wharf-London_England.html,"[['pencil-paper', '313'], ['thumbs-up-fill', '235']]","['Croydon, United Kingdom']",TerryE107,As good as the original,https://www.tripadvisor.co.uk/ShowUserReviews-g186338-d15238588-r662261185-The_Ivy_Canary_Wharf-London_England.html
143,,"['I do like The Ivy, trained staff, great food and smiley faces, its very personal in comparison to other brands. Love the deco. This one reminds me of the one in Manchester which is also great. ']", March 2019,g186338-d15238588-r661157656,g186338-d15238588,[],[],5,25 March 2019,The_Ivy_Canary_Wharf,/Restaurant_Review-g186338-d15238588-Reviews-The_Ivy_Canary_Wharf-London_England.html,"[['pencil-paper', '118'], ['thumbs-up-fill', '24']]","['Reykjavik, Iceland']",MariolaAhaha,Nibbles and drink,https://www.tripadvisor.co.uk/ShowUserReviews-g186338-d15238588-r661157656-The_Ivy_Canary_Wharf-London_England.html
144,,"[""Its obviously not the West End original but they've done an amazing job in a modernist box in the park in the middle of canary wharf ! The internal decor is familiar from Ivy restaurants, with lots of greenery and art deco art. The usual menu and fun bar: a martini to suit all tastes; we had a wide range of food from tempura shrimp,yellowfin tuna with wasabi mayo, and the for mains shepherds pie, roast chicken with truffle mash, and a monkfish and shrimp keralan curry - all delicious. washed down with a decent white wine, a couple of expresso martini's and a creme brûlée. £200 all in with a decent wine for 3 of us - a lovely Sunday lunch.""]", March 2019,g186338-d15238588-r662489761,g186338-d15238588,[],[],4,31 March 2019,The_Ivy_Canary_Wharf,/Restaurant_Review-g186338-d15238588-Reviews-The_Ivy_Canary_Wharf-London_England.html,"[['pencil-paper', '159'], ['thumbs-up-fill', '81']]","['London, United Kingdom']",AndrewR941,Lovely mothers day late lunch,https://www.tripadvisor.co.uk/ShowUserReviews-g186338-d15238588-r662489761-The_Ivy_Canary_Wharf-London_England.html
145,,"['We reserved a table for 4 this Saturday to celebrate a 33rd birthday. Our first step into this iconic building and i was greeted by the 3 friendly receptionists. The decor and ambiance is fantastic, nice touch with the DJ! We started with canopes and the signature g & ts! Fabulous. The mains followed which were equally as delicious and all served perfectly by Greg. He was courteous , polite and friendly. After dessert our hosts presented us with our birthday cake and digestive drinks. Well done team, keep up the good work. Overall a fantastic experience and we cant wait to return .']", April 2019,g186338-d15238588-r666117611,g186338-d15238588,[],[],5,13 April 2019,The_Ivy_Canary_Wharf,/Restaurant_Review-g186338-d15238588-Reviews-The_Ivy_Canary_Wharf-London_England.html,"[['pencil-paper', '12'], ['thumbs-up-fill', '5']]","['London, United Kingdom']",876steveo,"Perfect from start to finish, birthday celebration!",https://www.tripadvisor.co.uk/ShowUserReviews-g186338-d15238588-r666117611-The_Ivy_Canary_Wharf-London_England.html
146,,['Had the set menu at the Ivy. There was quite a lot to choose from. The portions were surprisinly quite generous and food was well presented. The service was good and staff were very friendly. The mains were all very nice and we all enjoyed. The desserts were delicious. Would definitely go back. Good value for money.'], January 2019,g186338-d15238588-r663288774,g186338-d15238588,[],[],4,2 April 2019,The_Ivy_Canary_Wharf,/Restaurant_Review-g186338-d15238588-Reviews-The_Ivy_Canary_Wharf-London_England.html,"[['pencil-paper', '88'], ['thumbs-up-fill', '61']]","['Merthyr Tydfil, United Kingdom']",Wedding08_12,Set lunch menu,https://www.tripadvisor.co.uk/ShowUserReviews-g186338-d15238588-r663288774-The_Ivy_Canary_Wharf-London_England.html
147,,"['A few of us worked all day on a booth at Excel and headed out to dinner right afterwards. We didn’t have a reservation but managed to get a table right away. The service was very friendly. The seating is a quite comfortable and the menu quite extensive. The wine list is also quite extensive although a little pricey. ', 'We had a vegetarian and pescatarian plus two meat eaters. All of us were very happy with the whole dinner. ', 'The one slight flaw was that the smoke from the people smoking outside the front door was wafting in to our table all the time so we didn’t enjoy that at all. But the food and company made up for it!!']", April 2019,g186338-d15238588-r664533736,g186338-d15238588,[],[],4,7 April 2019,The_Ivy_Canary_Wharf,/Restaurant_Review-g186338-d15238588-Reviews-The_Ivy_Canary_Wharf-London_England.html,"[['pencil-paper', '337'], ['thumbs-up-fill', '129']]","['Bridgetown, Barbados']",NicholasK887,Good dinner for vegetarian and pescatarian ,https://www.tripadvisor.co.uk/ShowUserReviews-g186338-d15238588-r664533736-The_Ivy_Canary_Wharf-London_England.html
148,,"['Met here for drinks, having booked a table for supper. The staff were impeccable from the start. Quick to serve us with drinks, then to easily bring forward our supper reservation to a more convenient time for us.', 'Upstairs in the dining area, the young waiter looking after our table was excellent. Professional, courteous and extremely helpful. ', 'Now for the food.', 'Once ordered, we waited quite a while for three cold starters and one scallops, which, were cold on reaching our table!', 'It was rectified quickly though and the next plate was hot.', 'I couldn’t have my first choice of main as they had just sold the last one! (We were in early at seven o’clock) so I opted for lamb. My mistake I suppose. Asked for medium but, in my opinion, the middle was almost raw. It was mentioned to the very kind waiter as he took our plates away. The other three meals were received and enjoyed.', 'The scallops and lamb were removed from the bill, which wasn’t asked for by any of our party. Top marks for that. ', 'I would be inclined to try again here, definitely for drinks downstairs, and maybe on a night less busy? if this is at all possible in London? ', 'For me personally, there are far better places to eat , but I’m willing to hold my hand up and say it could have been the wrong choice on the night. ', 'As mentioned though, the staff were faultless, and as a frequent visitor to this city, that means a lot.']", April 2019,g186338-d15238588-r665847275,g186338-d15238588,[],[],3,13 April 2019,The_Ivy_Canary_Wharf,/Restaurant_Review-g186338-d15238588-Reviews-The_Ivy_Canary_Wharf-London_England.html,"[['pencil-paper', '3']]",[],Lizziegi,Impeccable Staff/mediocre food,https://www.tripadvisor.co.uk/ShowUserReviews-g186338-d15238588-r665847275-The_Ivy_Canary_Wharf-London_England.html
149,,"['A nice welcome, very good service, (slightly fell away towards the end of our lunch) but a nice place, good food and value, I will certainly recommend and return.']", April 2019,g186338-d15238588-r665950885,g186338-d15238588,[],[],5,13 April 2019,The_Ivy_Canary_Wharf,/Restaurant_Review-g186338-d15238588-Reviews-The_Ivy_Canary_Wharf-London_England.html,"[['pencil-paper', '14'], ['thumbs-up-fill', '5']]",['Canterbury'],MichaelP59,Better than ‘expected’...,https://www.tripadvisor.co.uk/ShowUserReviews-g186338-d15238588-r665950885-The_Ivy_Canary_Wharf-London_England.html
150,,"['Perfect location, great menu and top service. Less pricy than you’ll expect!', 'Surprisingly busy already at 8am. It’s a must to book in advance.']", March 2019,g186338-d15238588-r658601075,g186338-d15238588,[],[],5,15 March 2019,The_Ivy_Canary_Wharf,/Restaurant_Review-g186338-d15238588-Reviews-The_Ivy_Canary_Wharf-London_England.html,"[['pencil-paper', '12'], ['thumbs-up-fill', '5']]",['london'],tonexi,Top place for a breakfast meeting,https://www.tripadvisor.co.uk/ShowUserReviews-g186338-d15238588-r658601075-The_Ivy_Canary_Wharf-London_England.html
151,,['Food is always consistent and delicious! Great spot for breakfast and brunch in the Canary Wharf area.'], March 2019,g186338-d15238588-r660353315,g186338-d15238588,"['Value', 'Service', 'Food']","['40', '50', '50']",5,22 March 2019,The_Ivy_Canary_Wharf,/Restaurant_Review-g186338-d15238588-Reviews-The_Ivy_Canary_Wharf-London_England.html,"[['pencil-paper', '29'], ['thumbs-up-fill', '37']]","['London, United Kingdom']",sommerhaustips,Great food!,https://www.tripadvisor.co.uk/ShowUserReviews-g186338-d15238588-r660353315-The_Ivy_Canary_Wharf-London_England.html
152,,"['I have been to this restaurant a number of times and I have to say the food is excellent every time. The only downside is that you will get treated according to your looks. whenever I have been smartly dressed, I have received excellent service. the last time I went I was disappointed to be given a table with a terrible view of construction and the worst service. I had to wait for ages to be served for my order and my food was not delivered as it was meant to. my bread came with my main meal and they forgot one item I ordered. hopefully this was an oversight but I doubt it very much. I will try again and amend the review the next time I go in jeans and trainers!']", February 2019,g186338-d15238588-r658178643,g186338-d15238588,"['Value', 'Service', 'Food']","['30', '20', '50']",3,13 March 2019,The_Ivy_Canary_Wharf,/Restaurant_Review-g186338-d15238588-Reviews-The_Ivy_Canary_Wharf-London_England.html,"[['pencil-paper', '18'], ['thumbs-up-fill', '5']]","['London, United Kingdom']",honestyinreviews,"if you don't dress the part, expect poor service",https://www.tripadvisor.co.uk/ShowUserReviews-g186338-d15238588-r658178643-The_Ivy_Canary_Wharf-London_England.html
153,,"['I just read a review that has the same feeling I have.', 'I live nearby and go often there.', 'During weekends just for brunch after gym. I get a sit by the bar, the guys already', 'Know me it .Is easy. It is one of my favourites eggs bennedict, just loosing to Balthazar in Covent Garden.', 'Yesterday (12 March) it was my first time durink business day on breakfast / lunch time wearing gym clothes and this time I booked a table as I wanted to enjoy my time and do some work ( I was carrying my laptop with me). I do think the maitre could avoid be around so much. It made be feel that or I had to leave or I should keep ordering things to be sit there. There were plenty of tables available. And I should be able to order when I feel that I want to order. Even if everyone around are on suits. If I work from home and I want to sit in a nice environment I should be welcome. Most when I come often to the restaurant.', 'I would give excellent but Considering this behaviour and reading a review with same feeling I will keep 4 stars as it is for sure something to be improved.']", March 2019,g186338-d15238588-r658231971,g186338-d15238588,[],[],4,13 March 2019,The_Ivy_Canary_Wharf,/Restaurant_Review-g186338-d15238588-Reviews-The_Ivy_Canary_Wharf-London_England.html,"[['pencil-paper', '329'], ['thumbs-up-fill', '105']]","['Sao Paulo, SP']",AnaPiussi,My favourite - but lay attention how you dress up,https://www.tripadvisor.co.uk/ShowUserReviews-g186338-d15238588-r658231971-The_Ivy_Canary_Wharf-London_England.html
154,,"[""Lovely elegant atmosphere to drink fancy drinks with friends! The G&T's were fantastic! Great atmosphere and perfect attentive service!""]", March 2019,g186338-d15238588-r658195726,g186338-d15238588,"['Value', 'Service', 'Food']","['40', '50', '40']",5,13 March 2019,The_Ivy_Canary_Wharf,/Restaurant_Review-g186338-d15238588-Reviews-The_Ivy_Canary_Wharf-London_England.html,"[['pencil-paper', '162'], ['thumbs-up-fill', '31']]","['Greater London, United Kingdom']",JulieDsTravels,Gin & Tonic with Friends,https://www.tripadvisor.co.uk/ShowUserReviews-g186338-d15238588-r658195726-The_Ivy_Canary_Wharf-London_England.html
155,,"[""I went this place last month, everything was superb food was delicious I ordered steak it was cook what I expected also service was effective only one thing I did't like it was very noisy""]", February 2019,g186338-d15238588-r659184837,g186338-d15238588,"['Value', 'Service', 'Food']","['40', '40', '40']",4,18 March 2019,The_Ivy_Canary_Wharf,/Restaurant_Review-g186338-d15238588-Reviews-The_Ivy_Canary_Wharf-London_England.html,"[['pencil-paper', '2'], ['thumbs-up-fill', '1']]",[],elizabethlauerman,Lovely food and service,https://www.tripadvisor.co.uk/ShowUserReviews-g186338-d15238588-r659184837-The_Ivy_Canary_Wharf-London_England.html
156,,"['Occasion: Pre-bridal celebration lunch for my best friend.', ""I visited The Ivy in London Bridge last August for a friend's birthday lunch and the service was terrible. I wasn't too keen on the idea of eating at The Ivy again after that experience but my friends really wanted to go as they had never been, so I agreed to give it one last try. "", 'I Just want to say a big THANK YOU to The Ivy Canary Wharf staff, in particular, Fillipo who looked after us the entire time while we were there and also Alex, the manager. They were both very welcoming, polite and kind. Honestly, the service overall was a 10/10 and me and the girls all agreed on this! ', 'Thank you very much for the excellent service you provided Filipo and Alex!']", March 2019,g186338-d15238588-r659256034,g186338-d15238588,"['Value', 'Service', 'Food']","['30', '50', '30']",5,18 March 2019,The_Ivy_Canary_Wharf,/Restaurant_Review-g186338-d15238588-Reviews-The_Ivy_Canary_Wharf-London_England.html,"[['pencil-paper', '3'], ['thumbs-up-fill', '1']]","['London, United Kingdom']",Lolaally,Late Lunch with my girls for a Bridal Celebration,https://www.tripadvisor.co.uk/ShowUserReviews-g186338-d15238588-r659256034-The_Ivy_Canary_Wharf-London_England.html
157,,"['We had a warm greeting from the reception staff who took as to our table on the first floor, from which we had an extraordinary view of canary wharf. Our waitress Sabrina provided us with a high level of service, helping as with any queries we had. As the restaurant is located in canary wharf their are a lot of businesses guest meaning the atmosphere was peaceful and our waitress had the time to go the extra mile with us. Thank you so much for making our night. ', 'P.s My favorite touch was still providing us with water after we had paid the bill at which point most people would stop looking after you but she truly looked after us from start to finish.']", February 2019,g186338-d15238588-r659936458,g186338-d15238588,"['Value', 'Service', 'Food']","['50', '50', '50']",5,20 March 2019,The_Ivy_Canary_Wharf,/Restaurant_Review-g186338-d15238588-Reviews-The_Ivy_Canary_Wharf-London_England.html,"[['pencil-paper', '3'], ['thumbs-up-fill', '1']]","['London, United Kingdom']",NicolasSteven,"Amazing surroundings, Tasty food and Excellent service",https://www.tripadvisor.co.uk/ShowUserReviews-g186338-d15238588-r659936458-The_Ivy_Canary_Wharf-London_England.html
158,,"['Met son Chris for an early evening meal after an interesting walk via the docklands museum and a little bit of tropical rain forest. Warmly welcomed and straight to a tablr overlooking the grassy square that reminded me a bit of union square in San Francisco.', 'Had the appetisers rather than starters - what a great choice. Big bowl of matchstick thin utterly tasty zucchini fries with a dipping sauce, some lovely bread and some Moorish truffle aranchini - well enough for 3. ', ""Chris had the roast chicken and he loved its crispy coating. My steak tartare was as good as I've had outside France. When will british restaurants allow us to mix it ourselves?"", 'Great meal, great service - will definitely go again.']", March 2019,g186338-d15238588-r659482089,g186338-d15238588,"['Value', 'Service', 'Food']","['50', '50', '50']",5,19 March 2019,The_Ivy_Canary_Wharf,/Restaurant_Review-g186338-d15238588-Reviews-The_Ivy_Canary_Wharf-London_England.html,"[['pencil-paper', '639'], ['thumbs-up-fill', '233']]","['London, United Kingdom']",swpratt,everything cooked so well......,https://www.tripadvisor.co.uk/ShowUserReviews-g186338-d15238588-r659482089-The_Ivy_Canary_Wharf-London_England.html
159,,['Nice food. Lovely lager. Crab and salmon to start and a perfect medium cooked sirloin. Good value. 2 Nice bottle of wine at a reasonable price. Just shy of half a G for 7 people and a few lunchtime drinks. Waiters/esses are really helpful and nice. '], February 2019,g186338-d15238588-r654132029,g186338-d15238588,[],[],4,22 February 2019,The_Ivy_Canary_Wharf,/Restaurant_Review-g186338-d15238588-Reviews-The_Ivy_Canary_Wharf-London_England.html,"[['pencil-paper', '52'], ['thumbs-up-fill', '28']]","['London, United Kingdom']",mr_h_pinner,Business lunch,https://www.tripadvisor.co.uk/ShowUserReviews-g186338-d15238588-r654132029-The_Ivy_Canary_Wharf-London_England.html
160,,"['Great location and venue with excellent,professional friendly service but frankly the food was just not special. This is not fine dining but an upmarket chain. No specials, no real flair or anything different or exciting on the menu, which does not vary. For the money you could spend your cash more wisely.']", March 2019,g186338-d15238588-r658108440,g186338-d15238588,[],[],3,12 March 2019,The_Ivy_Canary_Wharf,/Restaurant_Review-g186338-d15238588-Reviews-The_Ivy_Canary_Wharf-London_England.html,"[['pencil-paper', '145'], ['thumbs-up-fill', '43']]","['London, United Kingdom']",simon p,Not what I had expcted,https://www.tripadvisor.co.uk/ShowUserReviews-g186338-d15238588-r658108440-The_Ivy_Canary_Wharf-London_England.html
