,answer_text,content,diner_date,id_comment,id_resto,other_ratings_category,other_ratings_value,rating,rating_date,resto,resto_url,reviewer_info_sup,reviewer_origin,reviewer_pseudo,title,url
54,,"['Great food Great service. Excellent restaurant,! Eclectic food and such a pleasant night for me and my family. I Will Come back soon, thank you for everything, thank you Alex']", October 2019,g186338-d15238588-r715580198,g186338-d15238588,[],[],5,5 October 2019,The_Ivy_Canary_Wharf,/Restaurant_Review-g186338-d15238588-Reviews-The_Ivy_Canary_Wharf-London_England.html,"[['pencil-paper', '1']]",[],680xarisk,Amazing experience,https://www.tripadvisor.co.uk/ShowUserReviews-g186338-d15238588-r715580198-The_Ivy_Canary_Wharf-London_England.html
55,,"['So we had lunch today at Canary Wharf the Ivy. The service was as good as it always at any of their establishments.', 'Our servers name was Brigitta,she was a really pleasant person very helpful', ' I had a chocolate bombe ,the Monk fish and prawn curry and it was gorgeous. I stole a few Arincini balls off my daughter , had to fight the temptation to steal all my husbands chips very crispy very tasty very Moreish.All in all worth every penny ,']", October 2019,g186338-d15238588-r719709848,g186338-d15238588,[],[],4,19 October 2019,The_Ivy_Canary_Wharf,/Restaurant_Review-g186338-d15238588-Reviews-The_Ivy_Canary_Wharf-London_England.html,"[['pencil-paper', '20'], ['thumbs-up-fill', '35']]",['LONDON'],CEEARNOLD,Lunch Today,https://www.tripadvisor.co.uk/ShowUserReviews-g186338-d15238588-r719709848-The_Ivy_Canary_Wharf-London_England.html
56,,"['I was in London for leisure with some friends, and my cousin suggested this restaurant in the financial district...it was delicious, from the starters to the dessert. The staff was very polite and kind. I really recommend you this place when visiting the financial district in London. ']", October 2019,g186338-d15238588-r718389222,g186338-d15238588,[],[],5,14 October 2019,The_Ivy_Canary_Wharf,/Restaurant_Review-g186338-d15238588-Reviews-The_Ivy_Canary_Wharf-London_England.html,"[['pencil-paper', '98'], ['thumbs-up-fill', '16']]","['Biel, Switzerland']",sandrafY967EY,Delicious restaurant,https://www.tripadvisor.co.uk/ShowUserReviews-g186338-d15238588-r718389222-The_Ivy_Canary_Wharf-London_England.html
57,,"['I expected to receive better than average food from this restaurant, but it’s on a par with TGI Fridays. The decor is nice, the staff were very polite but the food is not worth the money. ', 'The biggest joke is they sell spirit mixer size cokes at full price. 200ml bottles are £3.75 + 12.5% service. £4.22 for a gulp of coke & a glass of ice. Coke is as expensive as beer. It’s a rip off, if you order a coke in a bottle, it should be 330ml. ', 'I will not be back for overpriced drinks & average food. ']", October 2019,g186338-d15238588-r720075175,g186338-d15238588,[],[],2,21 October 2019,The_Ivy_Canary_Wharf,/Restaurant_Review-g186338-d15238588-Reviews-The_Ivy_Canary_Wharf-London_England.html,"[['pencil-paper', '26'], ['thumbs-up-fill', '53']]",['London'],jetboy_uk,Average food. Overpriced tiny soft drinks. £4.22 for 200ml of Coke ,https://www.tripadvisor.co.uk/ShowUserReviews-g186338-d15238588-r720075175-The_Ivy_Canary_Wharf-London_England.html
58,,['Visited for breakfast in October for a group of 12 people. Extremely friendly and helpful staff and had a table on the first floor overlooking the garden / mini park. Good range on the menu and reasonably priced. Service was excellent. '], October 2019,g186338-d15238588-r720902113,g186338-d15238588,[],[],5,24 October 2019,The_Ivy_Canary_Wharf,/Restaurant_Review-g186338-d15238588-Reviews-The_Ivy_Canary_Wharf-London_England.html,"[['pencil-paper', '561'], ['thumbs-up-fill', '140']]","['Hornchurch, United Kingdom']",O6824WYmiker,Excellent breakfast ,https://www.tripadvisor.co.uk/ShowUserReviews-g186338-d15238588-r720902113-The_Ivy_Canary_Wharf-London_England.html
59,,"['This place is huge and was concerned that it could be pretty hectic at breakfast - not at all! Only the downstairs is really occupied and it’s all nicely spaced out tables.', 'The food was great - all of us were pleased . I had slight food envy from the avo on toast that someone had but wasn’t disappointed at all in my own choice. ', 'Would definitely book again ']", October 2019,g186338-d15238588-r721414671,g186338-d15238588,[],[],4,26 October 2019,The_Ivy_Canary_Wharf,/Restaurant_Review-g186338-d15238588-Reviews-The_Ivy_Canary_Wharf-London_England.html,"[['pencil-paper', '499'], ['thumbs-up-fill', '156']]","['Reigate, United Kingdom']",Y8689CIdebbiew,Great breakfast,https://www.tripadvisor.co.uk/ShowUserReviews-g186338-d15238588-r721414671-The_Ivy_Canary_Wharf-London_England.html
60,,['We back again to the Ivy to celebrate my dad birthday. The service and food never disappoints us. Just perfect. Great and warm atmosphere in the first floor during brunch time. '], September 2019,g186338-d15238588-r714093110,g186338-d15238588,[],[],5,30 September 2019,The_Ivy_Canary_Wharf,/Restaurant_Review-g186338-d15238588-Reviews-The_Ivy_Canary_Wharf-London_England.html,"[['pencil-paper', '8'], ['thumbs-up-fill', '2']]","['London, United Kingdom']",GoshGT,Always best choice ,https://www.tripadvisor.co.uk/ShowUserReviews-g186338-d15238588-r714093110-The_Ivy_Canary_Wharf-London_England.html
61,,"['Lots of nice staff, not too busy when we went for breakfast, but had a long wait for everything. Coffee was lukewarm and sent it back. Toast was dry and over cooked. Side of bacon only arrived after asking twice where it was. Another long wait for pastries....', 'Manager was apologetic and gave us a discount but will not be eating here again.']", September 2019,g186338-d15238588-r713846005,g186338-d15238588,[],[],2,29 September 2019,The_Ivy_Canary_Wharf,/Restaurant_Review-g186338-d15238588-Reviews-The_Ivy_Canary_Wharf-London_England.html,"[['pencil-paper', '86'], ['thumbs-up-fill', '18']]","['London, United Kingdom']",Mile-Enders,Should have gone to Starbucks,https://www.tripadvisor.co.uk/ShowUserReviews-g186338-d15238588-r713846005-The_Ivy_Canary_Wharf-London_England.html
62,,"['I came for a friends birthday meal and the service was fantastic.', 'The barman had a great knowledge of the drinks and the waiter, who was really', 'Young, was knowledgable and really attentive and polite.', 'I ordered the chicken Milanese which wasn’t great (I asked for a recommendation and in fairness to the waiter he recommended other dishes that I just didn’t fancy at the time). I wasn’t that impressed with the chicken, it was nothing spectacular; the arracini was lovely, the spinach in cream was ok a bit sloppy and rich, The sweet potatoes again were ok but not bursting with flavour.', 'It hasn’t put me off because it was a lovely atmosphere and I think I need to order something else rather than play it safe with the chicken. ', 'I would definitely recommend and unlike me take up the recommendations from the waiters! ']", September 2019,g186338-d15238588-r711881060,g186338-d15238588,[],[],4,22 September 2019,The_Ivy_Canary_Wharf,/Restaurant_Review-g186338-d15238588-Reviews-The_Ivy_Canary_Wharf-London_England.html,"[['pencil-paper', '26'], ['thumbs-up-fill', '25']]",['London'],Clademc,Great service and ambience.,https://www.tripadvisor.co.uk/ShowUserReviews-g186338-d15238588-r711881060-The_Ivy_Canary_Wharf-London_England.html
63,,"['Went early evening, started with the shellfish cocktail, which was ok. Partner had the scallops, three that is.The mains: veal fine, but Chicken Milanese dry, regardless of the runny fried egg. Sides: chips great, but mash potatoes, although served with melted butter, were cold. By the time the server came over to check our meal I had already ate most of my main, so an offer to reheat the mash was too late. We were offered a complimentary coffee, but unfortunately my husband spotted a mouse running around on the terrace, where minutes earlier diners had sat. I have a rodent phobia so we asked for the bill. We discreetly told the waiter about the mouse, and was assured by ', 'the maitreD that pest control was dealing with the problem, but as the restaurant was situated on the green, it was to be expected. We arrived at 5pm, service started at 5. 17 and we left at 18.08. It was a very short, and disappointing birthday celebration.']", October 2019,g186338-d15238588-r715565943,g186338-d15238588,"['Value', 'Service', 'Food']","['20', '20', '30']",3,5 October 2019,The_Ivy_Canary_Wharf,/Restaurant_Review-g186338-d15238588-Reviews-The_Ivy_Canary_Wharf-London_England.html,"[['pencil-paper', '37'], ['thumbs-up-fill', '60']]","['London, United Kingdom']",toptripper186338,"Sorry, but I don’t do mice",https://www.tripadvisor.co.uk/ShowUserReviews-g186338-d15238588-r715565943-The_Ivy_Canary_Wharf-London_England.html
64,,"['The Ivy is a good option for brunch; we had eggs royale as well as eggs benedict, the latter missing a bit of salt and which could have had slightly more hollandaise sauce. Although a bit pricy compared to similar venues, those dishes are accompanied with fries, which is a plus! The highlight was the taste of the arancini, which were lovely. ']", September 2019,g186338-d15238588-r712042032,g186338-d15238588,[],[],4,22 September 2019,The_Ivy_Canary_Wharf,/Restaurant_Review-g186338-d15238588-Reviews-The_Ivy_Canary_Wharf-London_England.html,"[['pencil-paper', '41'], ['thumbs-up-fill', '13']]","['London, United Kingdom']",ad1402,Don't miss out on the Arancini,https://www.tripadvisor.co.uk/ShowUserReviews-g186338-d15238588-r712042032-The_Ivy_Canary_Wharf-London_England.html
65,,"['Great attentive service, delicious food, cocktails are just amazing, specially Salted caramel expresso martini. It was so professional touch with congratulations plaque for our special occasion. Just good vibes and pretty atmosphere. Will go there again and again.']", September 2019,g186338-d15238588-r714222309,g186338-d15238588,[],[],5,30 September 2019,The_Ivy_Canary_Wharf,/Restaurant_Review-g186338-d15238588-Reviews-The_Ivy_Canary_Wharf-London_England.html,"[['pencil-paper', '1']]","['London, United Kingdom']",Mary9B,Beautiful experience,https://www.tripadvisor.co.uk/ShowUserReviews-g186338-d15238588-r714222309-The_Ivy_Canary_Wharf-London_England.html
66,,"['Enjoyable family lunch again. Can’t fault the place, service and staff. Very good Gin selection. ', 'Suggestion: add more choices of craft beers. ']", September 2019,g186338-d15238588-r714248475,g186338-d15238588,[],[],5,30 September 2019,The_Ivy_Canary_Wharf,/Restaurant_Review-g186338-d15238588-Reviews-The_Ivy_Canary_Wharf-London_England.html,"[['pencil-paper', '5'], ['thumbs-up-fill', '1']]",['London'],D447,Great place ,https://www.tripadvisor.co.uk/ShowUserReviews-g186338-d15238588-r714248475-The_Ivy_Canary_Wharf-London_England.html
67,,"['visited last Saturday for lunch at 2pm so arrived at 1 to be seated at the bar which serves really clean fresh drinks, a great bar, great bar staff. After being seated in the all day restaurant we were offered 2 menus one of which was vegetarian, a pleasant change and great selection. The waiting staff were excellent and very professional, this restaurant should make the others in Canary Wharf sit up as its head and shoulders above most if not all. I hope they keep up the standards.']", September 2019,g186338-d15238588-r715189364,g186338-d15238588,"['Value', 'Service', 'Food']","['50', '50', '50']",5,4 October 2019,The_Ivy_Canary_Wharf,/Restaurant_Review-g186338-d15238588-Reviews-The_Ivy_Canary_Wharf-London_England.html,"[['pencil-paper', '66'], ['thumbs-up-fill', '27']]","['London, United Kingdom']",david j,A pleasant change,https://www.tripadvisor.co.uk/ShowUserReviews-g186338-d15238588-r715189364-The_Ivy_Canary_Wharf-London_England.html
68,,"['Located in Canary Wharf, this restaurant was a perfect cap to the day . It had lots of windows overlooking the lawn with an eclectic British decor . The seating was comfortable which lenses itself to a night of fun and fellowship . The service was professional and efficient . We had the vegetable and real Shepherds pie . Both were delicious and served with Sauce . The fresh vegetables were prepared perfectly as an accompaniment . The bar service was the only slow service of the night . The desserts were spectacular . Overall a delightful experience . ']", October 2019,g186338-d15238588-r714845540,g186338-d15238588,[],[],5,2 October 2019,The_Ivy_Canary_Wharf,/Restaurant_Review-g186338-d15238588-Reviews-The_Ivy_Canary_Wharf-London_England.html,"[['pencil-paper', '818'], ['thumbs-up-fill', '168']]","['Orlando, Florida']",laj2e7,Great experience with good food and ambience ,https://www.tripadvisor.co.uk/ShowUserReviews-g186338-d15238588-r714845540-The_Ivy_Canary_Wharf-London_England.html
69,,"[""I came in today for lunch with an ex colleague and to be fair it was very good, I had the salmon fishcake with a side and it couldn't be faulted."", 'The service was equally very good.', ""It can be noisy when it's busy but I'd definitely return, the Ivy team did a great job today.""]", October 2019,g186338-d15238588-r714555399,g186338-d15238588,"['Value', 'Service', 'Food']","['40', '50', '50']",4,1 October 2019,The_Ivy_Canary_Wharf,/Restaurant_Review-g186338-d15238588-Reviews-The_Ivy_Canary_Wharf-London_England.html,"[['pencil-paper', '211'], ['thumbs-up-fill', '170']]",['UK'],RJB1000,Quick lunch visit was very good,https://www.tripadvisor.co.uk/ShowUserReviews-g186338-d15238588-r714555399-The_Ivy_Canary_Wharf-London_England.html
70,,"[""I have been working in Canary since 2017 and I have to say that The Ivy in The Park is the most well-structured restaurant in the area. Interior design, relaxing vibes, great atmosphere in combination with the outstanding service that I received made me feel so welcome. Genuine conversations with our main waiter, the manager made us feel like we knew each other for years. Excellent European food with plenty of options ,fantastic cocktails. It's a must, will definitely visit again and again again!""]", September 2019,g186338-d15238588-r711367965,g186338-d15238588,[],[],5,20 September 2019,The_Ivy_Canary_Wharf,/Restaurant_Review-g186338-d15238588-Reviews-The_Ivy_Canary_Wharf-London_England.html,"[['pencil-paper', '6'], ['thumbs-up-fill', '2']]",[],alexandrosk405,Hospitality at its finest!!,https://www.tripadvisor.co.uk/ShowUserReviews-g186338-d15238588-r711367965-The_Ivy_Canary_Wharf-London_England.html
71,,"[""Let me start by saying this restaurant has a great atmosphere. The decor is beautiful and it has a very positive energy. The ginger beer is refreshing, and I highly recommend it. But that's where the positives stop. The service was slow and lackluster. The food was average at best. I definitely expected more from an Ivy restaurant. In my opinion, it did not live up to the Ivy standard. ""]", August 2019,g186338-d15238588-r707243172,g186338-d15238588,[],[],3,6 September 2019,The_Ivy_Canary_Wharf,/Restaurant_Review-g186338-d15238588-Reviews-The_Ivy_Canary_Wharf-London_England.html,"[['pencil-paper', '64'], ['thumbs-up-fill', '31']]",[],Crab_Hunting_Girl,Disappointed ,https://www.tripadvisor.co.uk/ShowUserReviews-g186338-d15238588-r707243172-The_Ivy_Canary_Wharf-London_England.html
72,,"['I had my mothers 50th birthday celebrations at The Ivy on Saturday, the booking was at 3.30 pm for 12 people. I have been to their restaurants loads of times so thought it would be the perfect venue for a surprise afternoon tea. The tea was lovely and the men who served us were great and helpful.', 'The issue is I called up that morning to let them specifically know this was a surprise afternoon tea for my mums 50th so she had no idea about her friends and family being there, I asked if they could make a note and let reception know and I was assured this would be done and made a note of so nobody said anything when we arrived to give it away.', ""When we arrived at The Ivy and I told them my name the woman on reception said 'oh yes I think your other guests are here'. I tried covering this up and saying oh no there are no other guests but it was too late my mum had already heard and asked questions so she knew."", 'I know this would have been an accident but the fact I called to mention beforehand and then my mums surprise was totally ruined is a real shame and I expected better from such a well known brand and restaurant.']", September 2019,g186338-d15238588-r708060493,g186338-d15238588,"['Value', 'Service', 'Food']","['30', '10', '40']",3,9 September 2019,The_Ivy_Canary_Wharf,/Restaurant_Review-g186338-d15238588-Reviews-The_Ivy_Canary_Wharf-London_England.html,"[['pencil-paper', '1']]",[],rubyjune1992,A surprise afternoon tea that turned into not so much of a surprise!,https://www.tripadvisor.co.uk/ShowUserReviews-g186338-d15238588-r708060493-The_Ivy_Canary_Wharf-London_England.html
73,,"['Had a birthday lunch with my husband. The food and service was excellent. I thought it was going to really expensive it was reasonable. ', 'It was a warm day we sat upstairs which is partly open which was lovely. ', 'I will be returning.']", August 2019,g186338-d15238588-r708069748,g186338-d15238588,[],[],5,9 September 2019,The_Ivy_Canary_Wharf,/Restaurant_Review-g186338-d15238588-Reviews-The_Ivy_Canary_Wharf-London_England.html,"[['pencil-paper', '32'], ['thumbs-up-fill', '23']]","['London, United Kingdom']",Jeni007,Birthday Lunch ,https://www.tripadvisor.co.uk/ShowUserReviews-g186338-d15238588-r708069748-The_Ivy_Canary_Wharf-London_England.html
74,,"['What a pleasure to find this eatery. Felt totally looked after, even though we only ordered tonic water and one food course each. Noteworthy attention to detail. Menu is interesting. I had the Monkfish and Prawn Curry, brilliant. ', 'Found it hard to locate, good landmark is Waitrose, The Ivy is in the park opposite.']", September 2019,g186338-d15238588-r709299263,g186338-d15238588,"['Value', 'Service', 'Food']","['50', '50', '50']",5,13 September 2019,The_Ivy_Canary_Wharf,/Restaurant_Review-g186338-d15238588-Reviews-The_Ivy_Canary_Wharf-London_England.html,"[['pencil-paper', '120'], ['thumbs-up-fill', '30']]","['Gainsborough, United Kingdom']",philip m,Attention to Detail,https://www.tripadvisor.co.uk/ShowUserReviews-g186338-d15238588-r709299263-The_Ivy_Canary_Wharf-London_England.html
75,,"['Plenty of staff doing the rounds - none seemingly doing anything. 15 mins to take first drink order on a reserved table, in a what looked to be half full restaurant. Both main courses removed from bill as inedible (burger far too charred and cut up as if to check readiness? Sea Bass same overpowering charred flavour?). ', 'Ultimately a disappointing visit. Wouldn’t go again. One good is they made a very good cocktail off-menu, but that did not restore faith in The Ivy.']", September 2019,g186338-d15238588-r707942091,g186338-d15238588,[],[],1,8 September 2019,The_Ivy_Canary_Wharf,/Restaurant_Review-g186338-d15238588-Reviews-The_Ivy_Canary_Wharf-London_England.html,"[['pencil-paper', '3'], ['thumbs-up-fill', '1']]","['Glasgow, United Kingdom']",brad7roberts,Disappointing to say the least,https://www.tripadvisor.co.uk/ShowUserReviews-g186338-d15238588-r707942091-The_Ivy_Canary_Wharf-London_England.html
76,,"['I wandered in with a friend of mine for a quick Sunday brunch, and was immediately greeted by friendly receptionists and incredible decor. We have been showed to the cute table in the garden area. We have started with some zucchini and arancini, then followed with eggs benedict and royale that exceeded our expectations and are definitely best in town! All of this accompanied by their excellent selection of drinks. The icing on the cake was their salted caramel espresso martini so make sure you try it! Can’t recommend enough!']", September 2019,g186338-d15238588-r710267259,g186338-d15238588,[],[],5,16 September 2019,The_Ivy_Canary_Wharf,/Restaurant_Review-g186338-d15238588-Reviews-The_Ivy_Canary_Wharf-London_England.html,"[['pencil-paper', '1']]",[],AgataM455,Best of the Ivy Collection!,https://www.tripadvisor.co.uk/ShowUserReviews-g186338-d15238588-r710267259-The_Ivy_Canary_Wharf-London_England.html
77,,"['I came to celebrate my job promotion with work friends and from the time I entered the Ivy to the last step out it was amazing!! From start to end we had the most welcoming and polite waiter/waitress- I have to mention Alex and Marianne who firstly didn’t let our glasses go empty and secondly, Alex provided us with top entertainment as well as perfect hospitality! I’m so happy Vanessa introduced the Ivy to us and made us have such a great time! ', 'The venue is so pretty and a great vibe. The food is just as nice! We especially loved the desserts-Totally recommend it :)']", September 2019,g186338-d15238588-r710336350,g186338-d15238588,[],[],5,16 September 2019,The_Ivy_Canary_Wharf,/Restaurant_Review-g186338-d15238588-Reviews-The_Ivy_Canary_Wharf-London_England.html,"[['pencil-paper', '1']]",[],AminaPM,Dinner,https://www.tripadvisor.co.uk/ShowUserReviews-g186338-d15238588-r710336350-The_Ivy_Canary_Wharf-London_England.html
78,,"['Took a friend for a birthday meal and everything was perfect. The white onion soup was so tasty and hot too and the bread was delicious. Main courses of chicken Milanese and Shepherds pie were really good. The best Shepherds pie I’ve ever had. The chocolate bomb desert was really nice without being heavy or too rich. ', 'They brought my friend out a little cake with a candle. All the staff are fantastic, friendly and did a great job. ', 'I thoroughly recommend this restaurant and we will definitely be going back. ']", September 2019,g186338-d15238588-r710921003,g186338-d15238588,[],[],5,18 September 2019,The_Ivy_Canary_Wharf,/Restaurant_Review-g186338-d15238588-Reviews-The_Ivy_Canary_Wharf-London_England.html,"[['pencil-paper', '193'], ['thumbs-up-fill', '185']]","['Essex, United Kingdom']",MsVictoria,Superb meal,https://www.tripadvisor.co.uk/ShowUserReviews-g186338-d15238588-r710921003-The_Ivy_Canary_Wharf-London_England.html
79,,"['Amazing service from our main sever ridge supported by George and alex (possible managers im not sure) showing great team work throughout our visit,lovely drinks runner charlie was chatty and friendly when delivering cocktails. Food was excellently paired with the recommended red wine. Great company product knowledge from all staff will visit again!']", September 2019,g186338-d15238588-r711239823,g186338-d15238588,[],[],5,19 September 2019,The_Ivy_Canary_Wharf,/Restaurant_Review-g186338-d15238588-Reviews-The_Ivy_Canary_Wharf-London_England.html,"[['pencil-paper', '1']]",[],Gueststart,5*,https://www.tripadvisor.co.uk/ShowUserReviews-g186338-d15238588-r711239823-The_Ivy_Canary_Wharf-London_England.html
80,,"['Love all about The Ivy! Had another fantastic experience in the Canary Wharf branch. Staff and food never disappointing. Big thank you to our wonderful waitress, who promptly served us with our limited time before cinema. Asparagus with lobster and Milanese so so delicious! ']", August 2019,g186338-d15238588-r699153107,g186338-d15238588,[],[],5,15 August 2019,The_Ivy_Canary_Wharf,/Restaurant_Review-g186338-d15238588-Reviews-The_Ivy_Canary_Wharf-London_England.html,"[['pencil-paper', '8'], ['thumbs-up-fill', '2']]","['London, United Kingdom']",GoshGT,Fantastic ,https://www.tripadvisor.co.uk/ShowUserReviews-g186338-d15238588-r699153107-The_Ivy_Canary_Wharf-London_England.html
81,,"['We enjoyed an unplanned visit for dinner whilst in the area and enjoyed a lovely evening eating delicious food with wine topped off with the sublime salted caramel espresso martini recommended by our waitress. Staff were attentive and friendly throughout. We thought that the menu was good value.', 'We really enjoyed the ambience of the restaurant, it was very relaxed.The decor with the garden planting was very comfortable. I would recomment this restaurant if you are visiting the area.']", July 2019,g186338-d15238588-r706529608,g186338-d15238588,[],[],5,4 September 2019,The_Ivy_Canary_Wharf,/Restaurant_Review-g186338-d15238588-Reviews-The_Ivy_Canary_Wharf-London_England.html,"[['pencil-paper', '62'], ['thumbs-up-fill', '19']]","['Bognor Regis, United Kingdom']",LisaM5237,"Beautiful food, beautiful decor",https://www.tripadvisor.co.uk/ShowUserReviews-g186338-d15238588-r706529608-The_Ivy_Canary_Wharf-London_England.html
82,,['Delicious food. From the moment you arrive and have the most perfect zucchini fries. Care and attention is taken to every course- the food is absolutely wonderful. Staff are incredibly attentive to your every need. Decor is truly special and the fragrance throughout the restaurant (in particular the rest rooms) is divine. 5* experience.'], August 2019,g186338-d15238588-r699152131,g186338-d15238588,[],[],5,15 August 2019,The_Ivy_Canary_Wharf,/Restaurant_Review-g186338-d15238588-Reviews-The_Ivy_Canary_Wharf-London_England.html,"[['pencil-paper', '2'], ['thumbs-up-fill', '1']]","['London, United Kingdom']",mallia7,Wonderful date night,https://www.tripadvisor.co.uk/ShowUserReviews-g186338-d15238588-r699152131-The_Ivy_Canary_Wharf-London_England.html
