,answer_text,content,diner_date,id_comment,id_resto,other_ratings_category,other_ratings_value,rating,rating_date,resto,resto_url,reviewer_info_sup,reviewer_origin,reviewer_pseudo,title,url
0,,"['A fantastic evening in the Ivy, made particularly special by the the attentive waitress Amy (Auburn hair). She was attentive, knowledgable and funny, making the whole party feel at ease and welcome in the fantastic setting! Great job, I hope she is recognised for her professional and friendly attitude.']", January 2020,g186338-d15238588-r742139252,g186338-d15238588,[],[],5,30 January 2020,The_Ivy_Canary_Wharf,/Restaurant_Review-g186338-d15238588-Reviews-The_Ivy_Canary_Wharf-London_England.html,"[['pencil-paper', '2']]","['London, United Kingdom']",L8553AUwillb,A fantastic evening and a great waitress! ,https://www.tripadvisor.co.uk/ShowUserReviews-g186338-d15238588-r742139252-The_Ivy_Canary_Wharf-London_England.html
1,,"['Having frequented various Ivy restaurants and been very happy with both food and service, I selected this one for a birthday brunch with friends for my wife. This went off to a bad start because, the waitress spotted that I had brought my own birthday cake with me and wanted to take that away to the reception. ', 'Following, I asked to speak to a manager about this and had an unfortunate experience talking to Audrius, who I found lacked any kind of human emotion and was frankly facetious and patronising, there was obviously no negotiation on their matter of their ""health and safety policy"" over bringing external cakes, although it was clear from Audrius that the issue was really about the effect it would have on dessert sales. Audrius explained that this happens a lot, and many guest find themselves in my position and allowing any discretion would mean people: ""bringing their own wine or dogs to the restaurant”. This indicates to me, that customers have a desire to do exactly as I had done, and that the restaurant itself is not listening to customers’ desires or needs. Anyway, the discussion ended with him saying ""You have a choice to make?"", when I enquired as to the choice, I was told: ""To sit down and enjoy your meal or not?"", which I thought was unprofessional. If this was my brand I would not have such a person represent it.', 'Notwithstanding that the Ivy is not a patisserie, does not specialise in birthday cakes and anything they would have offered would have been far inferior. What is more frustrating is that when I called the restaurant prior to the booking, I was told that they can only provide birthday cakes for up to 5 people, and since there were 8 of us, this was not an option. Although Audrius insisted this was not the case, so not only poor management, but poor staff advice led to this situation occurring.', 'Even other restaurant guests who overheard the conversation made the effort to to approach us and offer their supporting voices that this was a ridiculous policy.', 'Talking to one of the other managers, Alex, when we left, who I found much more personable, and at least had the trait of human empathy, which honestly is the minimum I would expect from anyone in the hospitality industry. It was nice that someone in the restaurant was able to consider my situation and that of my guests from our perspective.', 'Food was less than the Ivy standard I have come to know which was extremely disappointing, especially as I introduced so many people to the Ivy for the first time and talked it up, perhaps it was just this particular restaurant, but I will never come here again, nor would I expect that from my guests who came for the first time. Several of us, commented was lacking in various ways. Unfortunately this occasion did not live up to my high expectations from the Ivy that I\'ve enjoyed at many other locations across London as a regular customer, but the ""Ivy in the Park - Canary Wharf"" has left me burnt and offended.', 'I seriously urge a reconsideration on the birthday cake policy, it’s surely a classic managerial short sightedness where you intend to increase revenue by potentially increasing sales of desserts on a single occasion, but neglect that you offend customers and limit future sales when people who’ve enjoyed friendly and accommodating service come back time and time again. Not to mention that even bringing your own cake means that customers would still purchase teas and coffees. Due to the hostility in this restaurant we took the cake and made the celebrations at another local venue who were more than happy to give us a table when we purchased a few drinks to go with it!']", January 2020,g186338-d15238588-r741794883,g186338-d15238588,"['Value', 'Service', 'Food']","['30', '10', '30']",2,28 January 2020,The_Ivy_Canary_Wharf,/Restaurant_Review-g186338-d15238588-Reviews-The_Ivy_Canary_Wharf-London_England.html,"[['pencil-paper', '12'], ['thumbs-up-fill', '7']]","['Bromley, United Kingdom']",damhy,Not Birthday Celebration Friendly! Beware.,https://www.tripadvisor.co.uk/ShowUserReviews-g186338-d15238588-r741794883-The_Ivy_Canary_Wharf-London_England.html
2,,"['All 6 people had a starter and a main course, no deserts. Excellent food all round, no complaints at all.', 'For the mains our group had;- Salmon, Black Miso Cod, Fillet Steak, Crab cakes and two Duck curry dishes. For starters we had the tuna carpaccio, scallops, tempura prawns,']", February 2020,g186338-d15238588-r747592193,g186338-d15238588,[],[],5,25 February 2020,The_Ivy_Canary_Wharf,/Restaurant_Review-g186338-d15238588-Reviews-The_Ivy_Canary_Wharf-London_England.html,"[['pencil-paper', '15'], ['thumbs-up-fill', '4']]","['Kent, United Kingdom']",MJ77777777,Monday night team dinner....,https://www.tripadvisor.co.uk/ShowUserReviews-g186338-d15238588-r747592193-The_Ivy_Canary_Wharf-London_England.html
3,,"[""We had a great time at the Ivy in Canary Wharf - as always, we weren't disappointed. We had four delicious cocktails and two of them were a self creation by Michele (I think one of the best cocktails I had!) - we will definitely come back to try some more creations! Exceptional service, thanks Michele!""]", February 2020,g186338-d15238588-r743502119,g186338-d15238588,"['Value', 'Service', 'Food']","['50', '50', '50']",5,7 February 2020,The_Ivy_Canary_Wharf,/Restaurant_Review-g186338-d15238588-Reviews-The_Ivy_Canary_Wharf-London_England.html,"[['pencil-paper', '1']]","['London, United Kingdom']",adamwT6573KC,Amazing Cocktails and Service!,https://www.tripadvisor.co.uk/ShowUserReviews-g186338-d15238588-r743502119-The_Ivy_Canary_Wharf-London_England.html
4,,"['My husband took me here for a meal as part of our wedding anniversary celebrations. This is a very pleasant environment with a lovely ambiance.I had the Salmon and my husband had the lobster. The food was superb, cooked to perfection. The desserts were good and it was difficult to choose from the fabulous selection. The staff were very attentive, in fact my only criticism would be they were too attentive, making me feel a little rushed. But all in all a good experience and I would definitely dine here again.']", January 2020,g186338-d15238588-r743218816,g186338-d15238588,"['Value', 'Service', 'Food']","['50', '50', '50']",5,5 February 2020,The_Ivy_Canary_Wharf,/Restaurant_Review-g186338-d15238588-Reviews-The_Ivy_Canary_Wharf-London_England.html,"[['pencil-paper', '39'], ['thumbs-up-fill', '9']]",['Stafford'],julesA1,Lovely anniversary meal,https://www.tripadvisor.co.uk/ShowUserReviews-g186338-d15238588-r743218816-The_Ivy_Canary_Wharf-London_England.html
5,,"[""Has a scrumptious meal to celebrate our friend's special birthday. Great company, great food, great ambiance. Our lovely visit was most definitely enhanced by our funny, friendly, wonderful waiter George, and another equally lovely head waiter whose name we didn't get...photo bomber you know who you are. Will definitely be returning #lovetheIvy""]", February 2020,g186338-d15238588-r743911955,g186338-d15238588,[],[],5,9 February 2020,The_Ivy_Canary_Wharf,/Restaurant_Review-g186338-d15238588-Reviews-The_Ivy_Canary_Wharf-London_England.html,"[['pencil-paper', '12'], ['thumbs-up-fill', '3']]",['cork'],pfizerhead,George the waiter enhanced the feel good factor!!,https://www.tripadvisor.co.uk/ShowUserReviews-g186338-d15238588-r743911955-The_Ivy_Canary_Wharf-London_England.html
6,,"['We took our mum here for a bday meal. We sat in the conservatory type area which was a bit chilly at some moments despite the hidden heaters under the tables. ', 'Food:', 'Good sized portions. The lobster risotto starter is delicious, sea bass main was okay (it comes with A LOT of oil). The Sirloin amazing!! BTW Chips portions are real portions :-)', 'Service:', 'Which is why I’m writing this review. We had Steve as our waiter; he was so lovely and always happy to help answer any questions. I’m a waiters nightmare, not deliberately but I love all food and I’m very indecisive about which option to commit to. Steve was happy to answer my questions and narrow my choices down to one. With my indecisiveness and our mum being on crutches, I sometimes worry that pretentious restaurant staff will put a downer on the evening. This was not the case at The Ivy Canary Wharf and I will definitely be returning again.']", February 2020,g186338-d15238588-r743837109,g186338-d15238588,[],[],4,9 February 2020,The_Ivy_Canary_Wharf,/Restaurant_Review-g186338-d15238588-Reviews-The_Ivy_Canary_Wharf-London_England.html,"[['pencil-paper', '2'], ['thumbs-up-fill', '5']]","['Essex, United Kingdom']",FoodieTay0,"Good food, Amazing service",https://www.tripadvisor.co.uk/ShowUserReviews-g186338-d15238588-r743837109-The_Ivy_Canary_Wharf-London_England.html
7,,"['We went here to celebrate a friends birthday , fab cocktail bar to start with , a variety of drinks to please all .This place has a garden feel with nooks and crannies ,we were in the conservatory .Lovely atmosphere , cosy and intimate and busy .Comfortable seating arrangements .The food was lovely, a varied menu , we all had different meals and everyone was happy with them . We thought it was very reasonable for London as we had quite a lot of alcohol to drink and went through the card for dinner .The chocolate bomb for dessert is to die for ! .Have no complaints at all with the staff or the service .A word of warning to the ladies with stilettos on , floor a bit slippery under foot ! Only a 3 minute walk from station .....Would love to go back !']", January 2020,g186338-d15238588-r745522441,g186338-d15238588,[],[],5,16 February 2020,The_Ivy_Canary_Wharf,/Restaurant_Review-g186338-d15238588-Reviews-The_Ivy_Canary_Wharf-London_England.html,"[['pencil-paper', '114'], ['thumbs-up-fill', '66']]","['Essex, United Kingdom']",Blossomhill1,Large table for a surprise birthday,https://www.tripadvisor.co.uk/ShowUserReviews-g186338-d15238588-r745522441-The_Ivy_Canary_Wharf-London_England.html
8,,"['Nothing to say, amazing service and very nice food. Great value as well. For sure we will be back soon!']", February 2020,g186338-d15238588-r745984203,g186338-d15238588,[],[],5,18 February 2020,The_Ivy_Canary_Wharf,/Restaurant_Review-g186338-d15238588-Reviews-The_Ivy_Canary_Wharf-London_England.html,"[['pencil-paper', '6'], ['thumbs-up-fill', '5']]","['London, United Kingdom']",elenatX4465YE,Great place and great food,https://www.tripadvisor.co.uk/ShowUserReviews-g186338-d15238588-r745984203-The_Ivy_Canary_Wharf-London_England.html
9,,"['I took my Mum here for a Christmas treat it was the first time for both of us and we loved it. ', ""We both choose dishes of the festive menu and both had the Lobster Shepherds Pie and Christmas Bomb dessert. I would never normally pick a Sheps pie but I'm so happy I did it was 10/10. I would definitely return for another meal as was a good price for quality. ""]", December 2019,g186338-d15238588-r746180295,g186338-d15238588,[],[],4,19 February 2020,The_Ivy_Canary_Wharf,/Restaurant_Review-g186338-d15238588-Reviews-The_Ivy_Canary_Wharf-London_England.html,"[['pencil-paper', '32'], ['thumbs-up-fill', '27']]","['Romford, United Kingdom']",roxmitchellx,Christmas Meal with Mum ,https://www.tripadvisor.co.uk/ShowUserReviews-g186338-d15238588-r746180295-The_Ivy_Canary_Wharf-London_England.html
10,,"['Came here with work colleagues after a full day at an Employment Tribunal representing work so needed to chill and eat.', 'Really nice venue and staff were very friendly.', 'A good selection on the menu prices wise for where we were not bad at all.', 'Food was great as I had the salmon and a naughty chocolate brownie for dessert.', 'If in the area would definitely return']", January 2020,g186338-d15238588-r739776811,g186338-d15238588,[],[],5,18 January 2020,The_Ivy_Canary_Wharf,/Restaurant_Review-g186338-d15238588-Reviews-The_Ivy_Canary_Wharf-London_England.html,"[['pencil-paper', '242'], ['thumbs-up-fill', '124']]",['London'],Ron S,"Lovely Venue, Great Food",https://www.tripadvisor.co.uk/ShowUserReviews-g186338-d15238588-r739776811-The_Ivy_Canary_Wharf-London_England.html
11,,"[""We visited The Ivy on Thursday 2nd January and as usual had a lovely time. From the warm and attentive welcome at reception, to the excellent food, to the friendly service staff. Special thanks goes to Tyra who is the most charming waitress we've ever met. Thanks for a perfect evening, John""]", January 2020,g186338-d15238588-r736993060,g186338-d15238588,[],[],5,5 January 2020,The_Ivy_Canary_Wharf,/Restaurant_Review-g186338-d15238588-Reviews-The_Ivy_Canary_Wharf-London_England.html,"[['pencil-paper', '5'], ['thumbs-up-fill', '1']]","['London, United Kingdom']",John K,"Great food, service and venue",https://www.tripadvisor.co.uk/ShowUserReviews-g186338-d15238588-r736993060-The_Ivy_Canary_Wharf-London_England.html
12,,"['Outstanding service, just had a dinner with my better half. We both had steaks (although mine was a bit of a disappointment) few starters and dessert, everything was perfect. We have been looked after the head waitress and the manager.', 'Great vibes, gives you a sort of vintage experience, kind of posh but not too formal.', 'Definitely coming back.']", January 2020,g186338-d15238588-r741637025,g186338-d15238588,"['Value', 'Service', 'Food']","['50', '50', '50']",5,27 January 2020,The_Ivy_Canary_Wharf,/Restaurant_Review-g186338-d15238588-Reviews-The_Ivy_Canary_Wharf-London_England.html,"[['pencil-paper', '10'], ['thumbs-up-fill', '2']]","['London, United Kingdom']",wladimircv,Trully great,https://www.tripadvisor.co.uk/ShowUserReviews-g186338-d15238588-r741637025-The_Ivy_Canary_Wharf-London_England.html
13,,"[""I went to The Ivy in The Park for New Year's Eve and I highly recommend it for everyone! Staff is very polite and the restaurant is stunning! Quality-price is good! Steve was our first waiter, who was very friendly and attentive, he recommended some dishes and I can tell the texture and the flavour were super! Valerio took care of us after the mains, he went extra mile to make our experience memorable and recommended an amazing desert!"", 'I will definitely come back! Thank you!']", December 2019,g186338-d15238588-r736900704,g186338-d15238588,"['Value', 'Service', 'Food']","['50', '50', '50']",5,4 January 2020,The_Ivy_Canary_Wharf,/Restaurant_Review-g186338-d15238588-Reviews-The_Ivy_Canary_Wharf-London_England.html,"[['pencil-paper', '4'], ['thumbs-up-fill', '1']]","['London, United Kingdom']",Sil-ftq,Amazing Service and Quality Food!,https://www.tripadvisor.co.uk/ShowUserReviews-g186338-d15238588-r736900704-The_Ivy_Canary_Wharf-London_England.html
14,,"['Overall I had a really pleasant evening catching up with some friends I had not seen for a while. Overall a nice meal, service was attentive without being obtrusive and the restaurant had a nice feel to it. It was a shame my steak was cooked incorrectly, I asked for medium rare and it was well done. However the mistake was dealt with quickly and efficiently. My companions were all happy with their meals. ']", January 2020,g186338-d15238588-r738527124,g186338-d15238588,[],[],4,11 January 2020,The_Ivy_Canary_Wharf,/Restaurant_Review-g186338-d15238588-Reviews-The_Ivy_Canary_Wharf-London_England.html,"[['pencil-paper', '469'], ['thumbs-up-fill', '271']]","['Leigh-on Sea, United Kingdom']",LoSDiner,Nice evening. ,https://www.tripadvisor.co.uk/ShowUserReviews-g186338-d15238588-r738527124-The_Ivy_Canary_Wharf-London_England.html
15,,"['Visited on a Saturday night. Lovely welcome and our initial waitress was pleasant and engaged with us. The food was mostly lovely. The exception was the chips, they were dry, tasteless & oven cooked in our opinion, We ordered wine and our main course was served before it arrived at the table. From this point on the new female server, now in a black suit did not engage with us. Our wine & water were topped up as she passed with out a single glance at us and the bottles replaced on the table with a definite thump. We were not asked if we wanted dessert but the menu was plonked in front of us without comment. We were then left for at least 20 minutes before anyone asked us if we wanted to order. As we wanted some cheese to go with our remaining wine we sat sipping water, once ordered the cheese took ages to arrive to the point that we asked ourselves who had ordered something complicated! The background music was too loud, without any discernible tune and had a constant beat that made it hard to ignore and conversation difficult. On a separate note ladies have to queue in the corridor before they even get onto the Ladies toilets and 3 cubicles for a restaurant of this size is inadequate. For a chain that pitches themselves as luxury we felt that they need to try a lot harder.']", January 2020,g186338-d15238588-r739965166,g186338-d15238588,"['Value', 'Service', 'Food']","['20', '20', '30']",3,19 January 2020,The_Ivy_Canary_Wharf,/Restaurant_Review-g186338-d15238588-Reviews-The_Ivy_Canary_Wharf-London_England.html,"[['pencil-paper', '28'], ['thumbs-up-fill', '12']]","['Greater London, United Kingdom']",PCDines,Average,https://www.tripadvisor.co.uk/ShowUserReviews-g186338-d15238588-r739965166-The_Ivy_Canary_Wharf-London_England.html
16,,"['The venue is quite attrsctive with a faux art deco theme but is let down by fairly mediocre food, including dry chips and slightly soggy milanese. Like many of the branches of the Ivy, much of the clientele seems to be there in the hope of spotting celebs but no chance of that in Canary Wharf!']", January 2020,g186338-d15238588-r739602301,g186338-d15238588,[],[],3,17 January 2020,The_Ivy_Canary_Wharf,/Restaurant_Review-g186338-d15238588-Reviews-The_Ivy_Canary_Wharf-London_England.html,"[['pencil-paper', '351'], ['thumbs-up-fill', '76']]","['West Byfleet, United Kingdom']",Matthew S,Flashy venue but food not up to scratch ,https://www.tripadvisor.co.uk/ShowUserReviews-g186338-d15238588-r739602301-The_Ivy_Canary_Wharf-London_England.html
17,,"['Went for dinner with my girlfriend on a Friday night, quite busy but lovely vibes. Food was good, especially the meat. We had Lobster Risotto as starter, a Steak Tartare and a Rib-eye as mains and a delicious Chocolate Bomb dessert, along with few cocktails from the special menu, both nice.', 'Special mention to the staff, in particilar our waiter Adam, incredibly helpful with recommending the courses and with a great sense of hospitality.']", January 2020,g186338-d15238588-r741030679,g186338-d15238588,[],[],5,24 January 2020,The_Ivy_Canary_Wharf,/Restaurant_Review-g186338-d15238588-Reviews-The_Ivy_Canary_Wharf-London_England.html,"[['pencil-paper', '2']]","['London, United Kingdom']",francescobraun,Great experience,https://www.tripadvisor.co.uk/ShowUserReviews-g186338-d15238588-r741030679-The_Ivy_Canary_Wharf-London_England.html
18,,"['My wife and I met our daughter for Saturday lunch and we were all delighted with the ambiance, excellent service and food. This is the third time we have eaten here and each time we have truly enjoyed the experience.']", January 2020,g186338-d15238588-r741326293,g186338-d15238588,"['Value', 'Service', 'Food']","['50', '50', '50']",5,26 January 2020,The_Ivy_Canary_Wharf,/Restaurant_Review-g186338-d15238588-Reviews-The_Ivy_Canary_Wharf-London_England.html,"[['pencil-paper', '147'], ['thumbs-up-fill', '30']]","['Torquay, United Kingdom']",Paul D,Centre of Canary Wharf an excellent dining experience,https://www.tripadvisor.co.uk/ShowUserReviews-g186338-d15238588-r741326293-The_Ivy_Canary_Wharf-London_England.html
19,,"['went for lunch, great vibe, great menu, staff were all very atentive and the resturant itself was bright and welcoming.. will definatley be back..']", December 2019,g186338-d15238588-r733561305,g186338-d15238588,[],[],5,19 December 2019,The_Ivy_Canary_Wharf,/Restaurant_Review-g186338-d15238588-Reviews-The_Ivy_Canary_Wharf-London_England.html,"[['pencil-paper', '101'], ['thumbs-up-fill', '78']]","['Bolney, United Kingdom']",jk7ng,great resturant,https://www.tripadvisor.co.uk/ShowUserReviews-g186338-d15238588-r733561305-The_Ivy_Canary_Wharf-London_England.html
20,,"['We had supper at 8pm and there were babies and children which I found odd. Or the restaurants fault oersay but unappetising with the noise and ambience. ', 'Our table tipped twice spilling drinks- wobbly and an attempted fix happened after the first time but didn’t work- Prosecco everywhere!! ', 'Food was well below par for the Ivy chain. My salmon was cold and the sauce, tasteless. The chips were awful. ', 'The zucchini fritti however were delicious as were the espresso martinis. ', 'Shan’t come again']", December 2019,g186338-d15238588-r734401169,g186338-d15238588,[],[],3,24 December 2019,The_Ivy_Canary_Wharf,/Restaurant_Review-g186338-d15238588-Reviews-The_Ivy_Canary_Wharf-London_England.html,"[['pencil-paper', '17'], ['thumbs-up-fill', '18']]","['London, United Kingdom']",Amelia1983,Below Par,https://www.tripadvisor.co.uk/ShowUserReviews-g186338-d15238588-r734401169-The_Ivy_Canary_Wharf-London_England.html
21,,['Such a lovely atmosphere. This restaurant is so chic and the staff are lovely and professional. Amy was our waitress and she was fab! Their food is amazing and priced superbly. Amy was so kind she even surprised our friend that is moving to the UK with a special dessert. I can 100% recommend them. Plus their afternoon tea sounds divine.'], January 2020,g186338-d15238588-r741009674,g186338-d15238588,[],[],5,24 January 2020,The_Ivy_Canary_Wharf,/Restaurant_Review-g186338-d15238588-Reviews-The_Ivy_Canary_Wharf-London_England.html,"[['pencil-paper', '2']]",[],AshleighLategan25,Dinner at the Ivy!,https://www.tripadvisor.co.uk/ShowUserReviews-g186338-d15238588-r741009674-The_Ivy_Canary_Wharf-London_England.html
22,,['I was impressed with the quiet and efficient service as well as the highly quality of the food served. The menu choice was highly suitable and appropriate. The overall quality of service and food represented very good value for money. I have no hesitation in recommending the Ivy at Canada Square.'], December 2019,g186338-d15238588-r733192650,g186338-d15238588,"['Value', 'Service', 'Food']","['50', '50', '50']",5,17 December 2019,The_Ivy_Canary_Wharf,/Restaurant_Review-g186338-d15238588-Reviews-The_Ivy_Canary_Wharf-London_England.html,"[['pencil-paper', '22'], ['thumbs-up-fill', '7']]","['Bedfordshire, United Kingdom']",mrpeterc2015,A gentle Saturday luncheon,https://www.tripadvisor.co.uk/ShowUserReviews-g186338-d15238588-r733192650-The_Ivy_Canary_Wharf-London_England.html
23,,['Came here for a catch up over drinks with a friend and was delighted with the service. Staff were happy to offer us a table at dinnertime and were happy to help seek drink recommendations from the bartender. Will definitely visit again.'], November 2019,g186338-d15238588-r736479635,g186338-d15238588,"['Value', 'Service', 'Food']","['40', '50', '40']",4,3 January 2020,The_Ivy_Canary_Wharf,/Restaurant_Review-g186338-d15238588-Reviews-The_Ivy_Canary_Wharf-London_England.html,"[['pencil-paper', '19']]","['London, United Kingdom']",umeshudeer,Good service and setting for a quiet catch up,https://www.tripadvisor.co.uk/ShowUserReviews-g186338-d15238588-r736479635-The_Ivy_Canary_Wharf-London_England.html
24,,"[""The restaurant is in a good location near the Canary Wharf stations. The staff were all excellent though the waitress who showed us to our table didn't seem too impressed that we wanted to change tables because the corner of our table was practically touching the corner of the adjacent table. Our 2nd table was slightly better though we were right next to our neighbours and we were squinting into the sun that was refecting off a local skyscraper. The food was all very good though as usual I left this city restaurant still feeling hungry and my wallet £40/person lighter.""]", December 2019,g186338-d15238588-r735356386,g186338-d15238588,[],[],4,29 December 2019,The_Ivy_Canary_Wharf,/Restaurant_Review-g186338-d15238588-Reviews-The_Ivy_Canary_Wharf-London_England.html,"[['pencil-paper', '170'], ['thumbs-up-fill', '60']]","['London, United Kingdom']",po_2010,"Good food, suspect seating, excellent service",https://www.tripadvisor.co.uk/ShowUserReviews-g186338-d15238588-r735356386-The_Ivy_Canary_Wharf-London_England.html
25,,"[""Recommended by our friends, this place don't dissapoint. All went well and my family had great time.""]", November 2019,g186338-d15238588-r735273975,g186338-d15238588,[],[],5,29 December 2019,The_Ivy_Canary_Wharf,/Restaurant_Review-g186338-d15238588-Reviews-The_Ivy_Canary_Wharf-London_England.html,"[['pencil-paper', '1']]",[],Savas7777,"Great location, service and food",https://www.tripadvisor.co.uk/ShowUserReviews-g186338-d15238588-r735273975-The_Ivy_Canary_Wharf-London_England.html
