,content
229,Unfortunately we had a really bad experience from beginning at Bokan Bar 
230,"We came to the bar as we heard is a really good one .1) The location is too out of reach , it means that I have to take in consideration to locate the venue "
231,The transport is not a problem 
232,Anyway this was not the main one reason 
233,"2) The main reason why I do this review is when we got to the mini reception Bokan bar upstairs, we needed to greet the staff not her to greet us "
234,"She finished with the ex client taking care of their coats, etc, then we asked for a table, she was in rush saying i wlll find one for you next to the window"
235,"She went to find something, we were following her as we didnt know what to do, wait at reception or what / she stops at one table and start chit chat with that clients or friends "
236,"She forgot about us or what? we dont meean to be rude, but finally we asked her, excuse me could we have a table please ? the second time"
237,"she got nervous and said oh sorry about it , let me find then she starts moving "
238,"Finally she gave us a table opposite the bar , no view"
239,Then she ignores us again
240,Thats reception girl
241,3) we ordered finally our drinks and we were happy we got the table...
242,till we got water x 3 times and the drinks didn't arrive
243,We asked for the drinks but we felt completely IGNORED We were waiting more than 25 Minutes there 
244,4 ) Finally we decided to leave the place..
245,"no drinks, no customer service, nothing"
246,Most of luxury bars they serve nuts or small snack as beginning free or as from the menu and have been asked by waitress.What is missing ? The Bokan Bar is a very highly recognized Bar in London
247,"You guys are competing with the bars and hotels around you The Pearson Room , Cinnamon restaurant Hilton, Scoff and Banter in Edwardian, etc but I have never had this kind of experience nowhere in such as 4 stars bar and Hotel "
248,"I have stayed in Dubai in Novotel, in Bahrain, and other places but never had this experience in my life"
249,We travel a lot and stay in 5 stars hotels
250,I would really want to come back but the customer service destroyed our evening
251,"And not the last one , we needed to spent time to get a taxi to re arrange our night out in the same time, time , energy, not good night out , money the last .."
252,we lost 
253,I believe to get good customer service you need to have good waitress and waiters who works in team and for the same goal to achieve the highly customer service and make each customer happy in order a business to be run properly
254,if you want keep your clients and business of course 
255,That is a priority
256,very dissapointing
257,Is not the first time we are going to the bar at Novotel Canary Wharf
258,"The location and views are amazing, but the service we always find is rude and very inefficient"
259,"They seem not happy with their job, always in rush and they have no time even for say hello when you are arriving to the place"
260,"We want to have some drinks and food around canary wharf area, apparently Bokan is the highest bar/restaurant within the area so we decided to check it out.It takes 20 minutes for the staff to come to the table saying a ""Hi"" and take orders..The whole atmosphere with the service we felt no difference than going to weatherspoon or other pubs"
261,"The food was ok, takes ages to wait for our drinks"
262,No waiter or waitress come to ask if we need another drink
263,Someone finally came to clear the table after the empty plates on the table for quite long time..We decided to leave and we have to walk to the bar to ask for the bill
264,"And we paid the bill with the full service charge while we didn't felt it was worth it.Anyway, will not recommend it to any of our clients or friends."
265,"Nice view, good food, but extremely loud due to dinner party in the restaurant"
266,"At times, it was impossible to understand the people sitting in front of you"
267,"Very unfortunate, were looking forward to a nice dinner."
268,"Fantastic views from the top floor of Novotel Canary wharf, looking back towards the centre of London"
269,"Ordered 2 drinks, cider and one of their cocktails, plus chips to snack"
270,Drinks and mayonnaise/tomato sauce arrived promptly
271,"Had our drinks, no sign of chips, waited and waited, the waitress came over to take away empty drinks, said haven't you got your chips .."
272,no ..
273,"she went away, and they arrived soon after, so obviously forgotten about"
274,Bill came to £26 so expensive for 2 drinks and chips.
275,I was taken there for my birthday
276,"The restaurant was full until 9pm, and so we had to settle for the bar"
277,"The place was very dark, and finding the table was not the say (for me, anyway)"
278,"The awful din emitted by a woman squealing into a microphone (they tell me that it is singing; but it has nothing in common with Covent Garden) was so loud because, apparently, it has to carry over three floors in the building"
279,The occasional breaks which she and her organ grinders took were the best bit - I could hear what was being said to me.I was not impressed by the requirement to hand over my bank card before an order could be taken
280,"What might have been done with it while it was out of my sight was a concern, although it seems to have been all right"
281,"Clearly, this Novotel has had more than its share of dodgy customers, although how they could escape easily from the 38th floor was a mystery to me.I was assured that the food in the restaurant is better than what is available in the bar"
282,This view was shared by our waiter
283,"In my view, the meal was significantly overpricedThe views across London were certainly breathtaking but, apart from the wonderful company I was in, these were the best part of the evening"
284,If I could get into the restaurant itself on a quiet night (i.e
285,"no squealing) I might try it again, but otherwise, for me, it lies between the very disappointing and a ripoff"
286,We booked Bokan as we had visited previously and thought the place had a wow factor
287,We had our nephew and niece visiting from Switzerland and wanted to share a special evening with them
288,The evening was ruined by the woman at the front desk (Julia?) who is quite frankly the rudest person we have ever had the misfortune to encounter in any restaurant
289,Despite having received an email confirming our booking she kept us standing in the corridor for 10 mins and kept insisting that we did not have a booking!! I even showed her the email
290,She was disingenuous and disinterested
291,In the end I asked to see her booking screen and was able to locate the booking immediately
292,She had no sense of how much embarrassment and upset she was causing to us all
293,She didn’t even apologise for her error
294,Atrocious level of service from her
295,
296,I've stayed here 3 times on business
297,Each time I have taken breakfast early (served from 06:30 during weekdays)
298,"Each time the English breakfast items are cold, at best tepid"
299,"I can imagine the chef starts cooking everything around 05:00 to be ready for 06:30, then places the serving dishes under an infra red light arrangement to keep it warm"
300,"Trouble is, it doesn't work! Nothing worse than a cold clammy sausage and cold baked beans"
301,"Only thing I ate at a decent temperature was a fried egg, coz the chef cooked it while I waited!Come on Novotel, find a better solution!"
302,"While there is no doubt Bokan is a well thought out, impressive bar & restaurant, it seems the emphasis is on the initial wow factor and stops there"
303,"The service leaves a lot to be desired.We visited on a Friday afternoon, the venue was not overly busy, maybe around 30 customers"
304,"After taking a seat, we waited for someone to take our order and kept waiting"
305,"Eventually we gave up and attempted ordering at the bar, but we were completely ignored by the staff"
306,"After returning to the table we were finally able to place an order, 40 minutes after arriving.There seemed to be one bar man with responsibility for making drinks, meaning we waited a further 20 minutes on our drinks coming.We decided to order another round, and this time we're helped by a very friendly and helpful member of staff who was happy to answer our questions regarding the drinks list"
307,"The list looks great and you are really spoiled for choice.A separate member of staff then came back to us informing that two out of the three ingredients from our Negronis were not available.Bokan is not short of staff, with around 8 staff on the floor at the time of our visit"
308,"However they were not not overly interested in serving us with a couple leant over the bar on their phones for the duration of our visit.This bar has the potential to be one of the best in the area, with fantastic views over London"
309,But it is hugely let down by lack of service.
310,We booked a table for 9 people at this venue backed by the mighty Novotel brand
311,I mentioned on a telephone conversation the reason for the booking (birthday celebration for my wife and other friends) and that we were bringing a cake
312,The person on the phone didn’t make any reference to any “policy” regarding this.On arrival we were first treated quite rudely because we were 15 min late
313,They lied to me in saying that they called me to see if we were coming and that because they couldn’t talk to me they cancelled my reservation
314,"However, after a while, they “magnanimously found a table for us”"
315,"When we arrived to the table, we were told that they were going to charge us ridiculous 5GBP per person for having a cake of our own"
316,"We said that we were willing to consume on drinks much more than that ridiculous amount which would not even equate to the price of a bottle of Champagne, and we were willing to consume several of those"
317,"The staff was totally unhelpful and unwilling to compromise to avoid ruining our celebrations, even after speaking to “the manager”, who we suspect wasn’t the real manager.Because there is plenty of venues in Canary Wharf, we simply decided to leave and have our cake and plenty of drinks somewhere else"
318,All I can say is that a view is nothing if you have such an appealing behaviour to your customers.
319,Have been here twice just for coffee but the level of service has been appalling both times
320,"First outing it took ages for someone to come to our table , though the place was quite"
321,When the coffees came they were tepid at best
322,Next time I tried to order 2 coffees at the bar from one of waiters but he seemed to just look at me as if it was beyond him and pointed to his colleague saying he would make then and then just walked off without telling his colleague
323,Then I waited and waited and nothing so I gave up
324,That's a just a coffee God knows what happens when you have a meal there I hate to think....
325,
326,"Yes the views are amazing, yes the cocktails are good but these mean nothing if the service does not live up to the expectations"
327,Their booking policy for the terrace appears to be simply untruthful and misleading
328,It's understandable that during good weather it will be busy
329,What is unacceptable is when you ask them to book they say that the system is blocked
330,Even if you say that you will call later they say that you cannot book and that you will have to walk in early
331,"You walk in early and surprise surprise, everything is already booked for the day! So basically they will not tell you that they are fully booked and you're lured in by the hope that there will be availability"
332,This might seem like a small detail to some but the lack of decency and honesty are definitely things that will stop me from going to this place again.
333,We paid two visits to bokan on Saturday first around 7:30pm where we were directed to the bar on the top floor this was fine and the barman prepared two rounds of three drinks as my brother came to meet us before we headed out for a meal
334,"The cocktails were good and the service was too however when we walked over to the roof terrace to take in the views where no one was sat because of the incremental weather it felt like the security had joined our party, on taking a picture on my phone of the skyline I turned and almost bumped into one of them who was so close behind me.We sat on a dry table to finish up our drinks whilst being stared at and by that time was ready to go.We went for our meal and returned around eleven.This time we were greated well and politely taken to a table on the lower level the guy was very nice and explained that if a booked table wasn't claimed in the next ten minutes we could have that as it had better views.We chose a cocktail each this time just the two of us and I went to the bar.The whole ambience of the place had changed staff felt very cold and unwelcoming and stressed"
335,We had another round and headed up to see the now darkened skyline where we were actually followed up the stairs out onto the terrace
336,To add to this upon looking at my receipts I have been overcharged on three of the four rounds and a service charge added even though I went to the bar for every drink.I am in no way a penny pincher but why have I been overcharged and what service am I paying for? There didn't seem to be any chance of a waitered service in the bar.I stayed at the hotel and the room was excellent.
337,"Recently I've discovered this place and decided to bring different friends to have drinks here and spend some time together over a nice prosecco glass!This place is split on 2 floors of which both have an internal part, with just the top floor having also a roof terrace"
338,It's at the 48th floor
339,"The majority of the internal design is made of wood and pastel fabric, with big cushions, chairs, and a stunning view! Literally you can see all of London!! I have the feeling of being in a winter cottage in the Alps, but with the view of being in a modern side of New York! I absolutely love it"
340,"The restrooms are also very nice and clean, and while washing your hands you still have the opportunity of looking outside and admire the view- yes from the restroom! A Big, enormous glass will give you this!The only downside that I've found every time I visited this place and spent money from the Bar, that I'm starting to be seriously annoyed by it - is that when you sit down even before you ask for drinks, they say ""you can be here just for 1 hour"" even when there is no message on the table saying ""reserved!"""
341,"The best part is that after one hour NO one comes to tell you ""hey you need to move!"""
342,Honestly they just need to try and tell me that - they would have no idea of how I would react
343,"I find pretty frustrating that in a rich and expensive place like this, they could have the authority to make me move because someone else needs to sit! If the manager reads this - I have enough money to stay there for hours and hours to drink and eat and I would like to be treated with the respect I deserve as a paying customer!! I really like this place, but the service and attitude I've received every time I visited this place, is disappointing"
344,Please improve
345,Value on the view: 10/10Value of the service: not applicableGeneral value: 7/10 
346,"Went for a friends birthday, and the surroundings, ambiance, and stunning views of London seemed like the ideal scene to have some drinks and celebrate"
347,"There were only 3 of us, and the staff seem friendly, the drinks kept coming, and we was having a great time"
348,"My friend accidentally knocked a drink over, and within 2 minutes the manager came over and said that security was watching us and to calm down"
349,(Knocking the drink over may have been coincidence)
350,"We were having a great time before this and would have easily stayed in there until closing, and spent a lot more money, but this made us want to leave straight away"
351,"The gentlemen could have come over to make sure we was good if he had a concern, or seen if we needed anything, but it felt like because security said something to him, he came over as the man, and told us to calm down"
352,It put us off and I don't think we will be going back
353,"There are enough rooftop bars in London, which are cheaper as well, and you won't get accused of anything either"
354,How one person can ruin a night!!!! 
355,Stayed at the Novotel with my family for three nights
356,Visited Bokan on the Friday night and it's clearly a popular venue for the beautiful people
357,"However, on our last night I asked reception if it was ok to take my son up to the bar to see the London skyline, as it's spectacular"
358,No problem he said.We went up to the 38th floor to be met by a young woman behind the desk who said if reception said it was fine to let a 12 year old in then it was fine
359,Juan behind the bar had other ideas
360,"He said he weren't welcome and despite the place being empty, it was a condition of their licensing laws"
361,"First time I've been refused two glasses of Sprite in a hotel bar! So, back down to the reception where the chap who said it was fine apologised profusely"
362,Apparently if my son had been 13 rather than 12 it would have been fine
363,I lodged a complaint as I've never been humiliated like it by a hotel bar in my life
364,Another more sympathetic member staff agreed that it was outrageous
365,On the Friday night I was in it there does seem to be a thread common in other reviews
366,"Staff are unnecessarily rude and customers (including hotel guests,) are treated like we are lucky to be there"
367,Skyline is spectacular but if you want to be treated like a human being try AquaShard
368,A horrible experience and one that really took the shine off a wonderful hotel
369,
370,The staff are incredibly rude and make the prices up as they go along
371,"Avoid, it's not as good as the staff think they they are.....We were there last night and the entire staff force were some of the rudest people we have ever had the misfortune to be ""served"" by"
372,At the door the front of house had the snottiness attitude and was not the least bit welcoming
373,The bar staff had unwarranted attitude and were argumentative at every opportunity irrespective of the amount of money we were spending
374,"They had the utter nerve to keep changing the prices of our drinks because the menus were in the ""process of being updated""! Here's a tip, update the menus and THEN put them on the tables! Don't tell your staff to come up with rough numbers and then get aggressive when we state our basic consumer rights..."
375,Unfortunately we have to return here in a few weeks for a corporate event
376,We'll be passing this review to our events team Monday in case there's the possibility of moving to another venue.
377,This place is beautiful but it's a total rip off
378,Firstly the lady on the door didn't want us in the bar
379,We turned up early as booking an area for 2 hours was £600! She said if we could find a table then we could sit at it but she didn't like the idea of 20 people and not sure why as we all have jobs and money! It took a man in our party to get a table for us and then she gave me dirty looks all night
380,The last straw was the prices advertised on the menu were not what we were charged
381,"The prosecco was £10 more! Also they add 20% to your bill when you buy from the bar! Surely this is not legal! We have a company party there in 2 weeks time, I will be very rude when I go back because the staff are up themselves big time!"
382,The bar lounge on level 39 has really lovely panoramic views
383,"Unfortunetly, the service is dreadful"
384,I have never come across such rude staff anywhere in London
385,My colleague's birthday drinks were totally ruined
386,The hostess on level 38 was abrupt with no customer skills
387,I was made feel unwelcome
388,Bar staff on level 39 were even worse
389,On several occasions when trying to buy a drink I was totally ignored
390,After waiting for some time I was told I had to queue somewhere else
391,No further details were given or explained to me
392,Buying a drink each time was such a challenge
393,Settling payments was another issue - each time different prices were applied for the same drink
394,"A tall waiter kept coming to our area throughout the night reminding us how we should have booked a table, despite half of the reserved ones being empty"
395,I don't understand why would you want to turn spending clients away when the place is half empty
396,The overall experience was very disappointing
397,"As an employee based in Canary Wharf, I was very excited about the opening of this venue"
398,"I thought it would be great for team outings, Friday drinks, leaving parties, etc"
399,There is no way I'm coming backing to Bokan and will not recommend to it to anyone in Canary Wharf
400,"When you charge premium prices for food, drinks and service, you just have to do better than my last night's experience."
401,Such a shame that what could be a great venue is totally ruined by the attitude of the staff- This included adding unjustified charges and being offensively rude
402,One to avoid
403,What an awful place
404,"The staff were hopeless, took forever to take our order and serve us"
405,"To top it off, they actually ruined my birthday surprise that was arranged for me by my friend"
406,They did this twice by asking him if I wanted dessert or should they bring the cake out!!! Talk about incompetence
407,Yet they wanted a form filling in prior to attending which was done in great detail
408,Clearly they don't communicate with each other
409,Now they are ignoring our email complaint which has been outstanding for 2 weeks
410,Avoid it and go elsewhere.
411,Myself and my girlfriend have eaten at the restaurant a few times and also regular users of the bar and we have even booked New Year's Eve there
412,We decided to take two friends of ours for a drink for the first and although we didn't make a reservation we went upon arriving we was told all the tables are full which we accepted and went to have a drink at the bar whilst waiting for our drinks someone left and a table become available which we sat down to enjoy the bottle of wine and also cocktails we ordered
413,We was then approached by Julia who should not be working front of house and rudely said you cannot sit there even though there was no one else to take the table at the time truly disgusted with her attitude and really had put he of going to what is in theory my local bar I suggest Mondrian at London Bridge there rumpus room bar is a lot more better run with friendly staff.
414,I visited Bokan on Friday night for a few drinks in your rooftop bar (39) with a few friends for one of their Birthdays
415,We were always going out after but really wanted to visit this place as it has of course recently opened and looked amazing
416,"When we arrived we were a little early so fully understandable that the table wasn’t ready but saying that, I called a good 30 mins before we was going to arrive and whoever answered the phone said the table was already ready"
417,We stood there awkwardly in everyone’s way by the entrance for a good 10 minutes waiting for someone to simply wipe down the table and clear the glasses so we could take a seat
418,"As we finally got taken over to the table 3 of the 5 of us take a seat and 2 of us left standing as there was only 3 chairs when the booking was for 5! As your waiter frantically panicked looking for 2 chairs, lucky another table offered us their 2 stools as your waiter came back saying he couldn’t find any"
419,By now you can imagine I wanted to just get up and leave due to the shambles going on around me
420,"Couldn’t get a table with enough chairs, could just about get my table and everyone seemed a little too busy to listen to what I was saying or to help"
421,Seemed a little under staffed to me.Finally we are at the table and 15 minutes later we get given the menu so we can order a drink
422,"After waiting another 20 mins for her to come back and take our order, we sat there patiently and waited for our drinks"
423,By now I wondered if they were ever going to turn up but eventually they did
424,"I didn’t think it took that long to make a drink, we didn’t even order food! Again, must have been understaffed as it wasn’t particularly busy but all we have done so far is wait"
425,Extremely inattentive.The drinks finally arrive! I have ordered my favourite cocktail (that isn’t even on the menu) a Pornstar Martini
426,"At first glance is looked amazing and by now I was so thirsty I was ready to drink it in 1! I sat there and thought, this is going to be so good and make up for the experience we have had so far, but…"
427,It was rancid
428,"I don’t know if your bar staff have ever had a pornstar martini anywhere else but I have never had such a sour tasting, dry, small pornstar martini in my life"
429,"Even the prosecco on the side was again, extremely dry and sour to the taste"
430,"I would never order a Pornstar Martini from here ever again, even worse that one I have had from the likes of Be At One or All Bar One and this is supposed to be an amazing rooftop bar competing with the likes of Radio Rooftop and Rumpus Rooms and it was just not even comparable"
431,"Id compare it from my experience so far to my local Weather Spoons.Right, ive had enough, we are leaving, attic bar is around the corner and ive been there before and know it is a safe bet"
432,This is me trying to salvage what dignity I have left as I have recommended this to everyone and booked it for a friends Birthday and it was just a shambles
